id,position,name,score,ratings,category,price_range,lat,lng,address,city,state,zip_code
35361,23,Roots Salad Kitchen,4.8,97,"Salads, Vegetarian, Coffee and Tea, Exclusive to Eats",,29.40632,-98.49346,403 Blue Star Ste 106, San Antonio, TX,78210
35362,21,"Smoothie King (1251 Austin Hwy, Suite 101)",4.6,56,"Juice and Smoothies, Drinks, Healthy",$$,29.48924,-98.44426,1251 Austin Hwy, San Antonio, TX,78209
35364,20,Juice Joint,4.8,44,"Healthy, Juice and Smoothies",$,29.4445478,-98.4944783,1621 N Main Ave, San Antonio, TX,78212
35365,15,Earth burger(Highway 281),4.6,17,"Burgers, Comfort Food, Desserts, Vegan Friendly, Vegetarian Friendly, Fast Food, Gluten Free, Kids Friendly, American, Healthy, Sandwiches, Ice Cream, Allergy Friendly",,29.639,-98.45758,20821 U.S. Highway 281 North #102, San Antonio, TX,78258
35366,14,Cositas Ricas - San Antonio,,,"Sandwiches, Juice and Smoothies, Comfort Food",$,29.497013,-98.535225,2527 Vance Jackson Road, San Antonio, TX,78213
35367,13,Fogo de Chao (San Antonio),4.6,32,"Steak, Brazilian",$$,29.4233969,-98.484431,849 E. Commerce St. #393, San Antonio, TX,78205
35368,12,Cafe Vida (Blanco),4.9,54,"Latin American, Mexican, Vegetarian, Family Meals, Healthy",$,29.62042,-98.51299,19179 Blanco Road, San Antonio, TX,78258
35370,10,Cafe Vida (Rogers Ranch),5,114,"Breakfast and Brunch, Healthy, Latin American, Family Meals",$,29.6044984,-98.5372048,2711 Treble Creek, San Antonio, TX,78258
35372,8,Starbucks (I-35 &amp; Walzem),4.6,90,"Bakery, Breakfast and Brunch, Cafe, Coffee &amp; Tea",$,29.5106127,-98.3949,4901 Walzem, San Antonio, TX,78218
35373,7,Fahrenheit32Sa,4.9,29,"Ice Cream + Frozen Yogurt, Desserts",$,29.497,-98.53529,2527 Vance Jackson Rd, San Antonio, TX,78213
35374,6,Revolucion Coffee and Juice @ the Rim,4.7,109,"Coffee and Tea, Vegan Friendly, Juice and Smoothies",,29.61115156,-98.59929152,5846 Worth Parkway, San Antonio, TX,78257
35375,5,Revolucion Coffee + Juice,4.9,59,"Juice and Smoothies, Coffee and Tea",$,29.426147,-98.489572,300 E Houston St, San Antonio, TX,78205
35376,3,Revolucion Coffee + Juice (Alamo Heights),4.8,158,"Coffee and Tea, Juice and Smoothies, Breakfast and Brunch",$$,29.5066425,-98.4669936,7959 Broadway St, San Antonio, TX,78209
35377,99,"UD Wings (21119 Hwy 281 south San Antonio, TX)",,,"Wings, American, Comfort Food",,29.6436,-98.45395,21119 U.S. 281, San Antonio, TX,78258
35378,2,"Bahama Buck's (7022 S New Braunfels Ave, Suite 1010)",4.6,24,"Desserts, Ice Cream &amp; Frozen Yogurt",$,29.3577561,-98.44817,7022 S New Braunfels Ave, San Antonio, TX,78223
35379,97,Taqueria Huentitan Jalisco,,,"Mexican, Latin American, New Mexican",$,29.46701,-98.52829,2318 Fredericksburg Rd, San Antonio, TX,78201
35380,98,Poblano's on the Plaza,,,"Mexican, Chicken, Tacos",,29.42456,-98.49345,115 Main Plaza, San Antonio, TX,78205
35383,94,Cafe Martinez,,,"Coffee and Tea, Breakfast and Brunch, Cafe",$,29.5020528,-98.5754674,7302 Louis Pasteur Dr, San Antonio, TX,78229
35384,93,Clear Light Coffee Co,,,"Coffee and Tea, Juice and Smoothies",,29.5561,-98.49757,12656 West Avenue, San Antonio, TX,78216
35386,92, Hawx Street Tacos Inside Ricky Bobby's,,,"Mexican, Chicken, Comfort Food, Exclusive to Eats",$,29.542763,-98.52754,2335 NW Military Hwy, San Antonio, TX,78231
35388,89,Star Mart,,,"Convenience, Everyday Essentials, Snacks, Home &amp; Personal Care, Family Meals",$,29.4395658,-98.534668,1537 Delgado Street, San Antonio, TX,78207
35389,88,Beer Central (Powered by Lula),,,"Convenience, Snacks, Everyday Essentials, Alcohol",$,29.55281,-98.40397,12434 Nacogdoches Road, San Antonio, TX,78217
35390,87,The Faktory Pizzeria,3.9,75,"Pizza, American, Italian",,29.43801,-98.54174,901 Northwest 24th Street, San Antonio, TX,78207
35391,86,Kirby's Steakhouse (San Antonio),,,"Steak, American, Seafood",$,29.61007,-98.48869,123 North Loop 1604 East, San Antonio, TX,78232
35392,85,De Jamaica Kitchens SA,4.6,61,"Caribbean, Jamaican, Comfort Food, Allergy Friendly",,29.45834,-98.32083,8669 Interstate 10 East, San Antonio, TX,78109
35393,84,Taqueria Hacienda Tapatia,4.5,115,"Mexican, Latin American, New Mexican",$,29.4883489,-98.4016194,6402 N Interstate 35, San Antonio, TX,78218
35394,82,Lion's Den Eatery,,,"Mediterranean, Sandwiches, Bowls",,29.4903,-98.59918,5755 Evers Road, San Antonio, TX,78238
35395,81,Morton's The Steakhouse  (300 E. Crockett Street),,,"Seafood, American, Southern, Healthy, Desserts, Alcohol",$,29.4246212,-98.4850314,300 E. Crockett Street, San Antonio, TX,78205
35396,83,​​​​​​​Leaf or Liquor,,,"Alcohol, Wine",$,29.480309,-98.362175,6394 Rittiman Rd, San Antonio, TX,78244
35397,80,Dashi,4.8,20,"Asian Fusion, Asian, Korean",,29.57909,-98.44236,2895 Thousand Oaks Drive, San Antonio, TX,78232
35399,78,Ito Ramen,4.6,118,"Asian, Noodles, Japanese",$,29.5736562,-98.5158931,14395 Blanco Rd, San Antonio, TX,78216
35400,77,McDonald's® (2402 E Southcross),4.3,200,"American, Fast Food, Burgers",$,29.3751633,-98.4563184,2402 E Southcross Blvd, San Antonio, TX,78223
35402,75,buybuy BABY (522 Northwest Loop 410 Suite 108),,,"Gift Store, Baby, Retail",$,29.51963,-98.50209,522 Northwest Loop 410, San Antonio, TX,78216
35403,74,Gabriel's Wine &amp; Spirits,5,20,"Alcohol, Drinks, Liquor Stores, Wine",$,29.46672,-98.50761,837 West Hildebrand Avenue, San Antonio, TX,78212
35405,72,Tealicious Cafe,,,"Coffee and Tea, American, Breakfast and Brunch",,29.66152,-98.43696,3111 TPC Parkway, San Antonio, TX,78259
35408,69,PRESS Coffee,,,"Coffee and Tea, American, Breakfast and Brunch",$$,29.46395,-98.46608,4035 Broadway, San Antonio, TX,78209
35409,68,Don's &amp; Ben's,4.9,13,"Alcohol, Liquor Stores, Drinks, Wine",$,29.5452213,-98.5108298,11525 West Ave, San Antonio, TX,78213
35410,67,D &amp; B Liquor,4.3,21,"Alcohol, Drinks, Wine, Liquor Stores",$,29.425245,-98.46355,501 Saint James, San Antonio, TX,78202
35411,66,Leaf and Liquor,4.5,14,"Alcohol, Liquor Stores, Drinks",,29.50981,-98.37176,5816 Walzem Road, San Antonio, TX,78218
35412,1,Playa Bowls (San Antonio),4.9,131,"American, Vegetarian, Drinks",$,29.65323,-98.44833,22706 HWY 281 N, San Antonio, TX,78258
35413,65,Me Latte,,,"Coffee and Tea, American, Breakfast and Brunch",,29.59584923,-98.50994155,16900 Blanco Road, San Antonio, TX,78232
35414,64,The Good Kind Southtown,,,"Salads, American, Vegetarian",,29.41183,-98.48848,1127 S St Mary’s St, San Antonio, TX,78215
35415,63,Seazar's,,,"Alcohol, Liquor Stores, Drinks, Wine",$,29.48874,-98.45879,6422 N New Braunfels Ave, San Antonio, TX,78209
35416,62,Don's &amp; Ben's,5,29,"Alcohol, Liquor Stores, Drinks, Wine",$,29.510084,-98.379819,5516 Walzem Rd, San Antonio, TX,78218
35417,61,D &amp; B Liquor,4.8,31,"Alcohol, Drinks, Liquor Stores, Wine",$,29.5180579,-98.4490981,2506 Nacogdoches Rd, San Antonio, TX,78217
35418,60,Picoso Grill,,,"Mexican, Latin American, New Mexican",$$,29.55229,-98.40472,12400 Nacogdoches Rd., San Antonio, TX,78217
35419,59,Don's &amp; Ben's,,,"Alcohol, Drinks, Wine",$,29.488732,-98.445606,1235 Austin Highway, San Antonio, TX,78209
35420,58,Taipei Restaurant,4.8,46,"Asian, Noodles, Salads, Healthy, Chinese, Beef Noodles, Seafood, Rice Dishes, Family Meals, Vegetarian Friendly",,29.61304,-98.49288,18802 Stone Oak Pkwy, San Antonio, TX,78258
35421,57,Lol Liquors - O’Connor &amp; 1604 ,4.9,15,"Alcohol, Liquor Stores, Allergy Friendly",,29.60111,-98.40541,4330 N Loop 1604 E Ste 106, San Antonio, TX,78247
35422,56,Kum &amp; Go,,,"Convenience, Everyday Essentials, Home &amp; Personal Care",$,29.43819,-98.54111,910 Northwest 24th Street, San Antonio, TX,78207
35423,55,Pho Hung Cuong Restaurant (W Interstate 10),4.7,190,"Vietnamese, Noodles, Healthy",$,29.56213489,-98.59283716,12730 W Interstate 10, San Antonio, TX,78249
35424,54,Don's &amp; Ben's,,,"Alcohol, Drinks, Liquor Stores, Wine",$,29.5520702,-98.405522,12332 Nacogdoches Rd, San Antonio, TX,78233
35425,53,El Kiosko San Antonio,,,"Ice Cream &amp; Frozen Yogurt, Desserts, Juice and Smoothies, Sandwich",$,29.3570646,-98.51506,1427 SW Military Dr, San Antonio, TX,78221
35426,52,ProFlowers (1501 HARRY WURZBACH RD),,,"Flowers, Gifts, Plants, Gift Store",$$,29.47514,-98.4359,1501 HARRY WURZBACH RD, SAN ANTONIO, TX,78209
35427,51,El rincon del taco los compadres,4,12,"Mexican, Latin American, Tacos",,29.49234,-98.52641,3333 West Avenue, San Antonio, TX,78213
35428,50,Al Madina Meat Market Grill &amp; Pizza,4.8,12,"Halal, Chicken, Middle Eastern",$,29.5277641,-98.5650746,9218 Wurzbach Rd, San Antonio, TX,78240
35429,49,Krispy Kreme (1117 N Loop 1604 E),4.8,61,"Desserts, Donuts, Snacks",$,29.6110376,-98.4770094,1117 N Loop 1604 E, San Antonio, TX,78232
35430,48,Mencius's Gourmet Hunan,4.7,107,"Seafood, Sushi, Rolls, Vegetarian, Vegetarian Friendly",,29.51194,-98.56833,7959 Fredericksburg Rd, San Antonio, TX,78229
35431,47,Beer Central - Nacogdoches Road,4.5,11,"Convenience, Black-owned, Everyday Essentials, Alcohol, Snacks",,29.55281,-98.40397,12434 Nacogdoches Road, San Antonio, TX,78217
35432,46,L&amp;L Hawaiian Barbecue (1302 Austin Highway),4.7,36,"Hawaiian, BBQ, Seafood",$,29.48953,-98.44182,1302 Austin Highway, San Antonio, TX,78209
35433,45,7-Eleven (7050 N Interstate 35),,,"Everyday Essentials, Convenience, Home &amp; Personal Care, Snacks, Pizza, American",$,29.49589,-98.39998,7050 N Interstate 35, San Antonio, TX,78218
35437,41,Don's &amp; Ben's Liquor,5,20,"Alcohol, Drinks, Liquor Stores, Wine",$,29.4838238,-98.34758,6251 Woodlake Pkwy Ste 101, San Antonio, TX,78244
35438,40,Medina's Mexican Grill,4.6,64,"Mexican, Latin American, New Mexican",$,29.3979,-98.5046317,2711 S Flores St, San Antonio, TX,78204
35439,39,Basil Mediterranean Kitchen (New),4.7,57,"Mediterranean, Salads, Sandwich, Pizza",,29.534784,-98.565121,9955 W Interstate 10, San Antonio, TX,78230
35440,38,PJ Fresh (1815 N Foster Road),4.8,13,"Burgers, American, Sandwiches",$,29.44617,-98.3615603,1815 N Foster Road, San Antonio, TX,78244
35441,37,Taco-Tex,4.2,32,"Mexican, Latin American, New Mexican",$$,29.57947,-98.476615,15104 San Pedro Avenue, San Antonio, TX,78232
35442,36,24th St. Pizzeria,4.1,89,"Pizza, Wings, Italian, Salads, Family Meals",$,29.43799,-98.54176,901 Northwest 24th Street, San Antonio, TX,78207
35443,35,Baskin-Robbins (6418 N. New Braunfels Ave),4.7,22,"Desserts, Ice Cream + Frozen Yogurt, Comfort Food",$,29.4886428,-98.4587858,6418 N. New Braunfels Ave, San Antonio, TX,78209
35444,34,"Curry Consortium (220 Broadway,)",4.5,54,"Indian, Pakistani, Healthy, Gluten Free, Vegan",$,29.42816,-98.48725,220 Broadway, San Antonio, TX,78205
35445,33,Taqueria Los Dos Laredos #5,4.5,120,"Mexican, Latin American, New Mexican",$,29.41527,-98.46097,414 S New Braunfels Ave., San Antonio, TX,78203
35446,32,Cicis Pizza (6900 San Pedro Ave),4.6,54,"Pizza, Wings, Comfort Food",$,29.50606,-98.49858,6900 San Pedro Ave Ste 155, San Antonio, TX,78216
35447,31,Kong’s Express,4.5,200,"Chinese, Group Friendly",$$,29.419302,-98.5281694,903 S Zarzamora St, San Antonio, TX,78207
35448,30,Honey Baked Ham (999 East Basse),,,"Sandwich, Family Meals",$,29.498996,-98.467015,999 East Basse, San Antonio, TX,78209
35449,29,Bushwood BBQ,4,23,"BBQ, Wings, Family Meals",$$,29.5665951,-98.4531923,13800 Jones Maltsberger Rd, San Antonio, TX,78247
35450,28,Taqueria Jalisco #15 LLC,4.5,200,"Mexican, Breakfast and Brunch, Comfort Food",$$,29.5192083,-98.5961109,5527 Babcock Rd, San Antonio, TX,78240
35451,27,Sunsun Chinese Restaurant,4.1,200,"Chinese: Other, Chinese, Asian",$$,29.5019239,-98.5602532,5137 Fredericksburg Rd, San Antonio, TX,78229
35452,26,Wings Out (San Antonio),4.2,15,"Wings, Chicken, American",$$,29.42395,-98.48488,849 East Commerce Street, San Antonio, TX,78205
35453,25,Bahia Bowls San Antonio,4.8,104,"Salads, Bowls, Drinks",,29.64637,-98.42591,22103 Bulverde Rd, San Antonio, TX,78259
35454,24,BOILER HOUSE TEXAS GRILL &amp; WINE GARDEN,,,"Steakhouse, Steak, American",$$$$,29.4431834,-98.4803507,312 Pearl Pkwy Bldg 3, San Antonio, TX,78215
35455,23,Econ Liquor,,,,,29.523152,-98.4105196,9124 Perrin Beitel Road, San Antonio, TX,
35456,22,Piranha Izakaya,4.5,68,"Ramen, Japanese, Noodles",$,29.49438,-98.479,260 E Basse Rd, San Antonio, TX,78209
35457,21,Bayseas Seafood - Jones Maltsberger,4.7,50,"Seafood, American, Southern",$,29.552498,-98.4685201,12151 Jones Maltsberger Road, San Antonio, TX,78247
35458,20,Bayseas Seafood - WW White,4.5,108,"Seafood, American, Southern",$,29.4279869,-98.4060296,217 S WW White Rd, San Antonio, TX,78219
35459,19,"Jason's Deli (25 Ne Loop 410, Pavillion)",4.7,200,"Burgers, American, Sandwiches",$,29.5212765,-98.4939094,25 Northeast Interstate 410 Loop, San Antonio, TX,78216
35460,18,Brown Bag Sandwich Shop,4.5,37,"Sandwiches, American, Healthy, Soup, Deli, Desserts, Salads",,29.54107,-98.44409,11035 Wetmore Rd, San Antonio, TX,78216
35461,17,Rebel Wings (SAT02-1),2.9,15,"American, Wings, Fast Food, Chicken",$,29.5756,-98.41869,14730 Bulverde Road, San Antonio, TX,78247
35462,16,Panchito's (McCullough),4.8,200,"Mexican, Breakfast and Brunch, Family Meals, Alcohol",$,29.4684917,-98.4915254,4100 McCullough Ave, San Antonio, TX,78212
35463,15,30F Degrees,4.5,29,"Asian, Desserts, Juice and Smoothies",,29.51859,-98.5078,6903 Blanco Road, San Antonio, TX,78216
35464,14,Meemo's Bakery,4.8,93,"American, Breakfast and Brunch, Desserts, Family Friendly",$,29.5175695,-98.4490429,2611 Wagon Wheel, San Antonio, TX,78217
35465,13,Wendy's  (2422 EAST SOUTHCROSS BLVD.),4.3,88,"American, Burgers, Fast Food",$,29.374961,-98.455714,2422 EAST SOUTHCROSS BLVD., SAN ANTONIO, TX,78223
35466,12,Just Wing It. (905 Northwest 24th Street),3.1,26,"American, Chicken, Wings",$$,29.43816,-98.54172,905 Northwest 24th Street, San Antonio, TX,78207
35467,11,Church's Chicken (4747 Rittiman Road),4.3,54,"Fast Food, Family Meals",$,29.4844028,-98.3982951,4747 Rittiman Road, San Antonio, TX,78218
35468,10,Another Wing by DJ Khaled (SAT02-1),3.2,26,"American, Wings, Chicken",$,29.57497,-98.41831,14730 Bulverde Rd, San Antonio, TX,78247
35469,9,Twin Peaks (702 NW Loop 410),4.2,79,"Burgers, American, Sandwiches, Wings",$,29.5197588,-98.5037098,702 NW Loop 410, San Antonio, TX,78216
35470,8,Applebee's (Windsor Park),4.2,154,"American, Burgers, Salads, Healthy, Family Friendly, Comfort Food, Pasta, Sandwiches, Steak, Wings",$$,29.5068401,-98.3974603,7880 IH 35 North, San Antonio, TX,78218
35471,7,Popeyes (4535 Rittiman Rd),3.9,125,"American, Chicken, Family Meals, Fried Chicken, Comfort Food",$,29.48426,-98.404374,4535 Rittiman Rd, San Antonio, TX,78218
35473,5,Taco Bell (5318 W WALZEM RD),4,41,"Burritos, Fast Food, Mexican",$,29.509886,-98.3868926,5318 W WALZEM RD, San Antonio, TX,78218
35475,3,CVS (5506 WALZEM ROAD),4.5,13,"Everyday Essentials, Convenience, Pharmacy, Snacks",$,29.5099,-98.38076,5506 WALZEM ROAD, SAN ANTONIO, TX,75038
35476,2,Everyday Needs by Gopuff,4.9,146,"Everyday Essentials, Convenience, Alcohol, Snacks",$,0,0,2803 NE Loop 410 -, San Antonio, TX,78217
35477,1,7-Eleven (6110 N Pan Am Expy),4.5,79,"Convenience, Everyday Essentials, Snacks, Home &amp; Personal Care, Alcohol",$,29.483193,-98.402326,6110 N Pan Am Expy, San Antonio, TX,78218
35478,4,African Village restaurant,4.4,17,"Black-owned, African, Ethiopian",$,29.540939,-98.5514947,10918 Wurzbach Road suite 131, San Antonio, TX,78230
35479,3,Rehoboth Eritrean-Ethiopian Cuisine,4.9,28,"Black-owned, African, Ethiopian, Vegetarian, Healthy",$$,29.49443,-98.57016,1721 Babcock Rd, San Antonio, TX,78229
35480,2,Lagos Buka,3.8,47,"African, Comfort Food, Steak",,29.5108,-98.36881,6060 Montgomery, San Antonio, TX,78239
35482,68,"Soft Stream Sushi (427 Lombrano St,)",,,"Sushi, Japanese, Asian, Alcohol",$,29.44191,-98.51055,427 Lombrano St, San Antonio, TX,78207
35484,15,Kung Fu Kitchen Patio Bar,,,"Chinese, Exclusive to Eats",$,29.413485,-98.4996298,1010 S Flores St, San Antonio, TX,78204
35485,2,Texas de Brazil (San Antonio),4.8,29,"Steak, Brazilian, Latin American, Salads, Healthy",$$,29.4267454,-98.4891452,313 East Houston Street, San Antonio, TX,78205
35486,296,Leonardo's Italian Ristaurante  (Fredricksburg Rd.),,,"Italian, Pasta, Pizza",$,29.50447,-98.56121,5252 Fredricksburg Rd., San Antonio, TX,78229
35487,196,Tilo Tex Mex Mexican Restaurant,,,"Breakfast and Brunch, Mexican, Tex Mex",$,29.5530215,-98.5020812,12403 West Ave, San Antonio, TX,78216
35488,259,Subway (5619 Interstate 10 E),,,"Sandwiches, American, Healthy",$$,29.43968,-98.37999,5619 Interstate 10 E, San Antonio, TX,78219
35490,217,BUNZ,,,"Burgers, American, Sandwiches",,29.42643,-98.49286,122 E Houston St, San Antonio, TX,78205
35491,11,Nola Eats,,,"Cajun / Creole, Burgers, Seafood",,29.5099,-98.37922,5514 Walzem Road, San Antonio, TX,78218
35492,294,Shuck Shack,,,"Seafood, American",$$,29.4429916,-98.4746328,520 E Grayson St, San Antonio, TX,78215
35493,106,Gloria's Latin Cuisine (17623 La Cantera Pkwy #103),,,"Latin American, Tex Mex, Salvadorian",$,29.6095116,-98.5985887,17623 La Cantera Pkwy #103, San Antonio, TX,78257
35494,107,Munchies Shakes Snacks &amp; More (N Loop),,,"Ice Cream &amp; Frozen Yogurt, Comfort Food, Desserts",,29.61098,-98.47919,923 North Loop 1604 East, San Antonio, TX,78232
35495,12,Momma Luv's SOUL And Caribbean Food,4,24,"Caribbean, Seafood, Latin American, Soul Food",$,29.51001,-98.40868,2427 Austin Hwy, San Antonio, TX,78218
35496,11,Little Jamaica Caribbean Mix,,,"Caribbean, Latin American, Chicken",,29.51999,-98.46025,8816 Broadway Street, San Antonio, TX,78217
35497,9,Congas,,,"Spanish, Latin American, Puerto Rican, Cuban, Caribbean, Latin Fusion",$,29.5417772,-98.4113982,11211 Perrin Beitel Road, San Antonio, TX,78217
35498,284,Amigos Snacks And More #2,,,"Hot Dog, Sandwich, Drinks",,29.42517,-98.49461,1006 Vfw Boulevard, San Antonio, TX,78223
35499,282,Buckets Burgers &amp; Beer Garden,,,"American, Burgers, Desserts",$,29.39539,-98.40422,2014 S WW White Rd, San Antonio, TX,78222
35500,79,Thai Cuisine,,,Thai,$,29.636196,-98.4527025,2339 E Evans Rd, San Antonio, TX,78259
35501,277,The Angry Elephant,,,American,$,29.6215286,-98.4625147,19314 US-281, San Antonio, TX,78259
35504,272,Little Mexico,,,"Mexican, Burgers, Hot Dog",,29.47869,-98.52112,1607 West Hermosa Drive, San Antonio, TX,78201
35505,271,The Esquire Tavern (155 E Commerce St),,,"Burgers, American, Sandwiches",$,29.42472,-98.49176,155 E Commerce St, San Antonio, TX,78205
35508,261,Papas Burgers,,,"Burgers, American, Sandwiches, Family Meals",$,29.42584,-98.57534,709 Enrique M Barrera Pkwy, San Antonio, TX,78237
35509,265,HOT CHICKS (427 Lombrano Street),4.4,11,"American, Wings, Comfort Food",$,29.44191,-98.51055,427 Lombrano Street, San Antonio, TX,78207
35511,258,CHARLIE BURGER (427 Lombrano Street),3.9,36,"American, Burgers, Comfort Food",$,29.44191,-98.51055,427 Lombrano Street, San Antonio, TX,78207
35512,259,Alamo Hot Dog Co.,,,"American, Exclusive to Eats",$,29.4239674,-98.4900209,E Crockett St &amp; N Presa St &amp; W Crockett St, San Antonio, TX,78205
35513,257,Dirty Dawgs and Fries,,,"Burgers, American",$,29.5126252,-98.4896282,335 Sprucewood Ln, San Antonio, TX,78216
35514,256,"Papa's Burger  ""In God We Trust""",,,"Burgers, American, Sandwiches",,29.41253,-98.57402,972 Southwest 36th Street, San Antonio, TX,78237
35516,251,Juanys taqueria,,,"Mexican, Latin American, New Mexican",$,29.361352,-98.545365,1502 Somerset Rd, San Antonio, TX,78211
35518,248,Astro SuperBowl,,,"Burgers, American, Sandwiches",$,29.4945831,-98.4354869,3203 Harry Wurzbach Road, San Antonio, TX,78209
35519,245,Gaby Burger,,,"Burgers, American, Drinks",,29.44191,-98.51055,427 Lombrano Street, San Antonio, TX,78207
35520,244,Groove House,,,"American, Burgers",$,29.55261,-98.50303,12333 West Ave, San Antonio, TX,78216
35521,243,Wrigleyville Grill Food Truck,,,"Burgers, American, Sandwiches",$,29.4485445,-98.4875647,2410 N St Mary's St, San Antonio, TX,78212
35522,240,Nathan's Famous (SAT01-1),4.3,57,"Hot Dog, American, Comfort Food",$,29.54824,-98.37567,11911 Crosswinds Way, San Antonio, TX,78233
35523,242,Hometown Burger ( Fredericksburg Rd.),4.2,13,"Burgers, American, Sandwiches",$,29.46895,-98.53097,2719 Fredericksburg Road, San Antonio, TX,78201
35524,228,Soul Brotha #1 Wings,,,"Wings, American, Chicken",,29.51848,-98.43108,2015 Northeast Loop 410, San Antonio, TX,78217
35525,215,Headlines Mexican Spot,,,"Mexican, American, Fast Food, Healthy, Sandwich",,29.38656,-98.55009,2110 Cupples Road, San Antonio, TX,78226
35527,207,Taqueria Garibaldi (Walzem Rd),,,"Mexican, Latin American, New Mexican",$$,29.51065,-98.38542,5299 Walzem Road, San Antonio, TX,78218
35528,176,Sabor Del Pueblo,4.9,16,"Mexican, Latin American, New Mexican",,29.57181,-98.51715,13489 Blanco Road, San Antonio, TX,78248
35529,162,Amigos Snacks And More,4.2,42,"Mexican, Desserts",$,29.39864,-98.4731,107 Rigsby Avenue, San Antonio, TX,78210
35530,143,Taco Cabana (2908 Broadway),4.4,48,"Mexican, Tex Mex, Breakfast and Brunch, Family Meals",$,29.4536897,-98.4716044,2908 Broadway, San Antonio, TX,78209
35531,126,Jack in the Box (935) 7150 San Pedro Ave.,3.8,146,"American, burger, Fast Food",$,29.5134616,-98.498363,7150 San Pedro Ave., San Antonio, TX,78216
35532,100,Vallarta Grill and Bar,,,"Mexican, Latin American, New Mexican",$$,29.57606,-98.44345,14814 Jones Maltsberger Road, San Antonio, TX,78247
35533,97,Super Pollo Asados,,,"Mexican, Latin American, New Mexican",$$,29.5106399,-98.3930235,4927 Walzem Rd, San Antonio, TX,78218
35534,77,JAILBIRD (20907 Stone Oak Pkwy),,,"Burgers, American, Sandwiches",$,29.64963,-98.45279,20907 Stone Oak Pkwy, San Antonio, TX,78258
35537,101,Creamistry (21134 N US HWY 281 #101),,,"Desserts, Ice Cream, Frozen Yogurt",$,29.6401623,-98.4537124,21134 N HWY 281 #105, San Antonio, TX,78259
35538,97,Haagen Dazs (214 Alamo Plaza South),,,"Desserts, Ice Cream + Frozen Yogurt",$$,29.424966,-98.4863357,214 Alamo Plaza South, San Antonio, TX,78205
35539,94,Smoke Shack Meat Market,4.5,13,"Salads, American, Vegetarian",,29.46091,-98.46619,3710 Broadway Street, San Antonio, TX,78209
35540,93,Smack's Chicken Shack,,,"American, Wings, Chicken, Fried Chicken, Sandwich",,29.46672,-98.50106,447 West Hildebrand Avenue, San Antonio, TX,78212
35541,88,Sanitary Tortilla Company,,,"Mexican, New Mexican, Healthy",$,29.419426,-98.501349,623 Urban Loop, San Antonio, TX,78204
35542,85,Filipino Express (Grocery),,,"Convenience, Everyday Essentials, Home &amp; Personal Care",$,29.48839,-98.58476,4963 Northwest Loop 410, San Antonio, TX,78229
35543,64,"Veggie Wonderland (220 Broadway,)",4.6,31,"Indian, Vegetarian, Indian Curry, Healthy, Vegan",$,29.42816,-98.48725,220 Broadway, San Antonio, TX,78205
35544,53,Schlotzsky's (2514 Nacogdoches Road),4.9,29,"Salads, Sandwich, Deli, Desserts, Healthy, Family Meals",$,29.5182993,-98.4493801,2514 Nacogdoches Road, San Antonio, TX,78217
35545,32,The Ice Cream Shop,,,"Desserts, Ice Cream + Frozen Yogurt",$,29.4331,-98.54244,423 Northwest 24th Street, San Antonio, TX,78207
35546,19,Panera (999 E Basse Road),4.5,192,"Breakfast and Brunch, salad, Sandwich, Pizza, Healthy, American, Chicken",$,29.4972557,-98.4696513,999 E Basse Road, San Antonio, TX,78209
35547,292,Which Wich (1203 N. Loop 1604 West # 109),,,"Sandwich, American",$,29.6095425,-98.5104706,1203 N Loop 1604 W, San Antonio, TX,78258
35548,288,Piatti,,,"Italian, Pasta, Comfort Food",,29.49356,-98.47978,255 East Basse Road, San Antonio, TX,78209
35549,284,LandShark Bar &amp; Grill (San Antonio),,,"Burgers, American, Sandwiches",$,29.4235955,-98.4853304,849 East Commerce Street, San Antonio, TX,78205
35550,283,1718 Steakhouse - Stone Oak,,,"Steak, American, Fast Food",$,29.6487476,-98.4627898,20626 Stone Oak parkway suite 103, San Antonio, TX,78258
35551,274,Lala's Gorditas,,,"Mexican, Latin American, New Mexican",$,29.3874845,-98.4854073,1600 Roosevelt Ave, San Antonio, TX,78210
35552,261,Frederick's Restaurant,,,"European, Modern European, Seafood",$,29.499939,-98.467375,7701 Broadway, San Antonio, TX,78209
35553,252,Mary's Pizza and Pasta NY style,,,"Italian, Pasta, Pizza",,29.5115,-98.367,6206 Montgomery Drive, San Antonio, TX,78239
35554,250,Turquoise Grill,,,Turkish,$$,29.4925323,-98.5553088,3720 NW Loop 410, San Antonio, TX,78229
35555,247,Tink-A-Tako #9:,,,"Mexican, Latin American, Desserts",$,29.47379,-98.50807,2919 Blanco Road, San Antonio, TX,78201
35556,244,Pesto Ristorante - Judson,,,"Italian, Pasta, Comfort Food",$,29.5884485,-98.3790428,15179 Judson Rd, San Antonio, TX,78247
35557,249,Brasa Chicken,,,"Peruvian, Latin American, Seafood",$,29.5446402,-98.5093966,8523 Blanco Rd, San Antonio, TX,78216
35558,241,Rico's Diner,,,"American, Diner",$,29.4927479,-98.5518122,4522 Fredericksburg Rd, San Antonio, TX,78201
35559,225,Umami Burger (SAT01-1),3.5,26,"American, Burgers, Sandwiches",$,29.54784,-98.37637,11911 Crosswinds Way, San Antonio, TX,78233
35561,224,Deco Pizzeria (2026 Babcock Rd),,,"Pizza, Italian, Sandwich",$,29.5005911,-98.5797746,2026 Babcock Rd, San Antonio, TX,78229
35562,223,Al’s Famous Pitas,,,"Mediterranean, Greek, Vegetarian",,29.51007509,-98.37593693,5616 Walzem Road, San Antonio, TX,78218
35563,212,Tacos  El Takin,4.7,54,"Latin American, New Mexican",,29.55987,-98.39466,13131 El Sendero Street, San Antonio, TX,78233
35564,168,Arby's (Evans Rd.),4.7,52,"American, Sandwich, Fast Food, Kids Friendly",$,29.6364764,-98.4535426,2223 E Evans Rd, San Antonio, TX,78259
35565,162,Don Benitos Cocina y Cantina,,,"Mexican, Latin American, New Mexican",$,29.3518,-98.45425,2402 Southeast Military Drive, San Antonio, TX,78223
35567,139,Snooze AM Eatery (Vineyard),4.9,66,"Breakfast and Brunch, American, Sandwiches",$,29.60914,-98.51389,1305 N. Loop 1604 W., San Antonio, TX,78258
35568,135,Lick Honest Ice Creams ,,,"Ice Cream &amp; Frozen Yogurt, Desserts",$$,29.41909,-98.48643,639 Hemisfair Blvd, San Antonio, TX,78205
35569,133,Orange Leaf Frozen Yogurt (18030 Highway 281 North),,,"Ice Cream + Frozen Yogurt, Desserts",$,29.604519,-98.4687801,18030 San Pedro Ave, San Antonio, TX,78232
