id,position,name,score,ratings,category,price_range,lat,lng,address,city,state,zip_code
34517,6,Fiesta Liquor #3,3,,"African, Ethiopian, Vegetarian, Alcohol, Liquor Stores, Drinks, Wine",$,29.57432,-98.51521,14415 Blanco Road, San Antonio, TX,78248
34518,5,Squeezers Juice Bar,5,11,"Black-owned, Juice and Smoothies, African, Healthy, Allergy Friendly",,29.441,-98.48547,914 East Elmira Street, San Antonio, TX,78212
34520,76,Spinster Sisters Co. (427 Lombrano St),,,"Home &amp; Personal Care, Everyday Essentials, Alcohol",$,29.44191,-98.51055,427 Lombrano St, San Antonio, TX,78207
34521,194,Yaya's Thai Fusion,,,"Thai, Asian, Noodles",$,29.480652,-98.6079078,5819 Northwest Loop 410, San Antonio, TX,78238
34522,192,Willie's Grill &amp; Icehouse (7911 Interstate),4.5,92,"American, Burgers, Family Friendly, Wings, Alcohol",$,29.3500662,-98.5376722,7911 Interstate 35 Access Rd, San Antonio, TX,78224
34524,206,Pho Thien An,,,"Pho, Thai",$,29.5165683,-98.4951362,126 W Rector, San Antonio, TX,78216
34525,58,Wicked Panda,,,"Asian Fusion, Snacks, Wings",$,29.50998901,-98.37561373,5616 walzem rd, San Antonio, TX,78218
34526,1,The Roo Pub,,,Modern Australian,$$,29.6215669,-98.4624877,19314 US-281, San Antonio, TX,78259
34527,190,McDonald's® (1643 Pleasanton Road),4.2,167,"American, Fast Food, Burgers",$,29.3661261,-98.5045879,1643 Pleasanton Rd, San Antonio, TX,78221
34529,164,NOSH Kitchen ,,,"Burgers, American, Sandwiches",$,29.60736,-98.50146,434 North Loop 1604 West, San Antonio, TX,78232
34531,287,Copal Comida Mexicana &amp; Bar,,,"Mexican, Burgers, Steak",$,29.4813992,-98.5983586,5720 Bandera Rd, San Antonio, TX,78238
34532,284,Casasol Mexican restaurant  ,,,"Mexican, Latin American, New Mexican",,29.53006,-98.49549,9938 San Pedro Avenue, San Antonio, TX,78216
34533,57,Pokeman Sushi Bowl LLC,,,"Japanese, Hawaiian, Exclusive to Eats",$,29.45184,-98.46923,223 Brackenridge Ave, San Antonio, TX,78209
34534,55,Poke Planet,,,Hawaiian,$$,29.5020338,-98.5754882,7302 Louis Pasteur Dr., San Antonio, TX,78229
34535,46,Southern Grit,,,"Sandwiches, South American",,29.45726,-98.47001,3303 Broadway, San Antonio, TX,78209
34536,38,Halcyon,,,"Sandwich, Breakfast and Brunch",$,29.4098191,-98.495428,1414 S Alamo St, San Antonio, TX,78210
34537,35,Asian Vegan,4.7,77,"Asian Fusion, Vegan, Vegetarian, South East Asian, Gluten Free",,29.5326,-98.52164,2177 Northwest Military Highway, San Antonio, TX,78231
34538,283,The Barn Door,,,"American, Seafood, Steak, Exclusive to Eats",$,29.51246,-98.4595,8400 North New Braunfels Ave, San Antonio, TX,78209
34539,280,Las Chiladas,,,"Seafood, American, Southern",$,29.54472,-98.52919,2387 NW Military Hwy, San Antonio, TX,78213
34540,278,Pueblo Viejo,,,"Mexican, Latin American, New Mexican",$,29.4450681,-98.4915367,1626 McCullough Ave, San Antonio, TX,78212
34541,277,Millano Risorante Ital,,,"Italian, Pasta, Comfort Food",$,29.62896,-98.49591,19239 Stone Oak Pkwy, San Antonio, TX,78258
34543,265,Tata’s Tacos,4.3,17,"Mexican, Latin American, New Mexican, Tacos",,29.47469,-98.52571,1400 West Avenue, San Antonio, TX,78201
34544,227,El Golfo De Mexico,,,"Mexican, Latin American, New Mexican",$$,29.48803,-98.51913,2034 Basse Road, San Antonio, TX,78201
34545,222,Noel's Nachos,,,"Mexican, American, Fast Food, Desserts",,29.38656,-98.55009,2110 Cupples Road, San Antonio, TX,78226
34546,221,La Fonda (Alamo Height),,,"Italian, Pasta, Comfort Food",$$,29.5149696,-98.4612309,8633 Crownhill Blvd, San Antonio, TX,78209
34547,215,The Philly Cheesesteak Company (1011 N Loop 1604 E),3.9,41,"American, Sandwiches, Desserts",$,29.61114,-98.47781,1011 N Loop 1604 E, San Antonio, TX,78232
34548,201,Shawarmatee,4.7,48,"Mediterranean, Chicken, Falafel, Middle Eastern",,29.52846,-98.57586479,9523 Fredericksburg RD, San Antonio, TX,78240
34549,183,Stone Werks Big Rock Grille (Basse Rd),,,"Pizza, American, Italian",$$,29.4974544,-98.4671666,999 E Basse Rd, San Antonio, TX,78209
34551,171,Zito's Delicatessen &amp; Sandwich Shop (8800 Broadway Street),4.8,11,"Sandwiches, American, Healthy",$$,29.52026,-98.46073,8800 Broadway St, San Antonio, TX,78217
34552,160,"Nachos Muchachos (427 Lombrano St,)",3.2,33,"American, Mexican, Snacks",$$,29.44191,-98.51055,427 Lombrano St, San Antonio, TX,78207
34553,145,Sonic (6608 Fm 78),4.2,37,"Sandwich, Fast Food, burger, Hot Dog, American",$$,29.48178,-98.35766,6608 Fm 78, San Antonio, TX,78244
34554,122,Wild Wing Station (Walzem Road),,,"Wings, American, Fast Food",$$,29.50982,-98.38128,5502 Walzem Road, San Antonio, TX,78218
34555,109,Golden Meals,4.7,88,"Mediterranean, Greek, Vegetarian",,29.45865,-98.46809,3500 Broadway, San Antonio, TX,78209
34556,92,Jamaica Jamaica Cuisine,,,"Caribbean, Seafood, Latin American",$$,29.50237,-98.41699,2026 Austin Hwy, San Antonio, TX,78218
34557,81,Cristan's Tacos,,,"Mexican, Latin American, New Mexican",$$,29.50943,-98.37989,8054 Midcrown Drive, San Antonio, TX,78218
34558,78,El Pilon Sabor Boriqua,4.8,73,Puerto Rican,$,29.4698051,-98.4386455,1127 Harry Wurzbach Rd, San Antonio, TX,78209
34559,74,54th Street Restaurant &amp; Drafthouse - (Rector),4.6,153,"Burgers, American, Sandwiches, Family Meals",$,29.5164891,-98.4788928,954 East Rector Street, San Antonio, TX,78216
34561,56,La Madeleine Country French Cafe (4820 Broadway),4.7,146,"European, French, Pasta",$,29.4709494,-98.4628797,4820 Broadway, San Antonio, TX,78209
34562,27,El Jarro De Arturo,4.8,24,"Salads, Chicken, Pasta, Family Meals, Healthy",$$,29.5650087,-98.4840888,13421 San Pedro Ave, San Antonio, TX,78216
34563,216,Bun 'N Barrel (1150 Austin Hwy),,,"BBQ, American, Burgers",$,29.48689,-98.44762,1150 Austin Hwy, San Antonio, TX,78209
34564,214,Tee’s ribs,,,"BBQ, American, Burgers",,29.51387,-98.43189,1946 Northeast Loop 410, San Antonio, TX,78217
34566,212,Ed's Smok-N-Q,,,"BBQ, American, Burgers",$,29.4167521,-98.405066,902 S Ww White Rd, San Antonio, TX,78220
34567,210,Big Mama's Taste of Soul,,,"American, Burgers, Soul Food, Seafood, Comfort Food",,29.5092,-98.37622,5616 Walzem Road, San Antonio, TX,78218
34568,208,Mr. A Ok's Kitchen,,,"BBQ, American, Burgers",$$,29.50885,-98.37964,5532 Walzem Road, San Antonio, TX,78218
34569,206,The Smokehouse,4.4,49,"BBQ, American, Burgers",$,29.3968,-98.43461,3306 Roland Rd, San Antonio, TX,78210
34570,205,Billy Bob's Bar-b-que,,,"BBQ, American, Sandwiches",,29.574386,-98.439458,3030 Thousand Oaks Drive, San Antonio, TX,78247
34571,203,Smokin Joe's of Texas,,,"BBQ, American, Burgers",$,29.5338895,-98.3789798,114 N Weidner Rd, San Antonio, TX,78233
34572,202,Burger King (1515 North New Braunfels Ave),4.1,28,"American, burger, Fast Food, Family Meals",$,29.4373236,-98.4611915,1515 North New Braunfels Ave, San Antonio, TX,78208
34573,196,Red Point Pizza,,,"Pizza, American, Italian",$,29.5785,-98.37369,15033 Nacogdoches Rd, San Antonio, TX,78247
34574,195,Tyga Bites (826 San Pedro Avenue),,,"Chicken, American, Sandwiches, Desserts",$,29.4415,-98.49891,826 San Pedro Avenue, San Antonio, TX,78212
34575,193,Backyard on Broadway,,,"Burgers, American, Sandwiches",,29.44883,-98.47519,2411 Broadway Street, San Antonio, TX,78215
34576,194,Eat A Burger,,,"Burgers, American, Sandwiches",,29.51848,-98.43108,2015 Northeast Loop 410, San Antonio, TX,78217
34577,192,BBQ Done Wright,,,"BBQ, American, Comfort Food",,29.38999,-98.52056,2432 Nogalitos Street, San Antonio, TX,78225
34578,191,The Purple Pig BBQ,,,"BBQ, American, Burgers",$,29.4997848,-98.4211392,1916 Austin Hwy, San Antonio, TX,78218
34579,190,Holy Smoke BBQ &amp; Taquitos (Camp 1604),,,"BBQ, American, Tacos",,29.59132,-98.59142,5534 North Loop 1604 West, San Antonio, TX,78249
34581,188,Backwoods BBQ &amp; Grilled Cheeses,,,"BBQ, American, Burgers, Exclusive to Eats",$,29.55085,-98.40636,12234 Nacogdoches Road, San Antonio, TX,78233
34582,187,King Lou's Soul Food &amp; BBQ,,,"Black-owned, American, Sandwich, Burgers",,29.4254176,-98.452482,2553 E Houston St, San Antonio, TX,78202
34585,185,FAT BASTARDS BBQ &amp; GRILL,,,"BBQ, American, Burgers",,29.4241,-98.4936,7530 Bandera Road, San Antonio, TX,78238
34586,181,Skywalk Sports Bar BBQ &amp; Grill,,,"BBQ, American, Wings",$,29.5334095,-98.5586601,10227 Ironside Dr, San Antonio, TX,78230
34587,180,Bella Pizza (8132 Fredericksburg Rd),,,"Pizza, American, Italian, Chicken, BBQ",$,29.51551,-98.57069,8132 Fredericksburg Rd, San Antonio, TX,78229
34589,167,Kain Na - Filipino Cuisine,,,"Comfort Food, American, Burgers",$$,29.52497,-98.41187,9323 Perrin Beitel Road, San Antonio, TX,78217
34590,160,DEE WILLIES,,,"BBQ, American, Sandwich",,29.5497,-98.37583,12130 O'Connor Road, San Antonio, TX,78233
34592,158,Applebee's (North Star),4.5,122,"American, Burgers, Salads, Healthy, Family Friendly, Comfort Food, Pasta, Sandwiches, Steak, Wings",$$,29.5210713,-98.4847806,97 Loop 410 NE., San Antonio, TX,78216
34593,154,The County Line - IH 10,4.5,36,"BBQ, American",$$,29.5374792,-98.5673484,10101 IH-10 West, San Antonio, TX,78230
34594,150,El Sabrosito Jalisco Restaurant,,,"Mexican, Latin American, New Mexican",$$,29.53382,-98.37905,118 N Weidner Rd, San Antonio, TX,78233
34595,149,Rooster's Run Shavano Park,,,"Wings, Chicken",,29.60145,-98.56197,4051 North Loop 1604 West, San Antonio, TX,78257
34596,142,Rooster's Run Zarzamora,3.5,10,"Wings, Chicken",,29.35008,-98.53771,7911 Interstate 35 Access Road, San Antonio, TX,78224
34597,146,El Molino,,,"Mexican, Latin American, New Mexican",$$,29.43919,-98.47006,1703 North PanAm Expressway, San Antonio, TX,78218
34598,141,Fire &amp; Slice,3.3,15,"Pizza, Comfort Food, Vegetarian",$,29.43802,-98.54174,901 NW 24th St, San Antonio, TX,78207
34599,138,House of Wings ,,,"American, Wings, Fast Food, Sandwiches, Salads, Chicken",,29.43802,-98.54174,901 Northwest 24th Street, San Antonio, TX,78228
34600,121,Skinny Black BBQ &amp; More,,,"BBQ, American, Burgers",$$,29.41324,-98.43336,3102 Martin Luther King Drive, San Antonio, TX,78220
34601,126,Plant B (Stone Oak),,,"Burgers, American, Sandwiches",$,29.64963,-98.45279,20907 Stone Oak Parkway, San Antonio, TX,78258
34602,116,Tita Jelas Kusina (427 Lombrano Street),,,"American, Comfort Food, Healthy",$$,29.44191,-98.51055,427 Lombrano Street, San Antonio, TX,78245
34603,111,Kona Grill (North Star),4.5,41,"American, Sushi",$$,29.518406,-98.4952585,7400 San Pedro Ave, San Antonio, TX,78216
34604,106,"Jason's Deli (9933 IH -10 West, Colonade)",4.7,200,"Burgers, American, Sandwiches",$,29.5342454,-98.5641294,9933 West Interstate 10, San Antonio, TX,78230
34605,103,Snack Attack - Nacogdoches Rd,4.8,13,"Ice Cream + Frozen Yogurt, Snacks, Black-owned, Convenience, Everyday Essentials",,29.55285,-98.4039,12434 Nacogdoches Road, San Antonio, TX,78217
34608,43,Rooster's Run Hill Country Village,,,"Chicken, Wings, Sandwiches",,29.58632,-98.47587,15801 San Pedro Avenue, San Antonio, TX,78232
34613,7,Smoke BBQ &amp; Brew,4.5,57,"BBQ, American",$$,29.42424,-98.48076,501 E Crockett St, San Antonio, TX,78202
34614,163,In a Bun (SAT01-1),,,"Burgers, Sandwich, American, Bar Food",$,29.54784,-98.37637,11911 Crosswinds Way, San Antonio, TX,78233
34615,162,The Other Side (SAT01-1),,,"Burgers, Sandwich, American, Bar Food",$,29.54784,-98.37637,11911 Crosswinds Way, San Antonio, TX,78233
34616,161,The Lord's Kitchen,,,"Burgers, American, Sandwiches, Fast Food",$,29.4365083,-98.4603659,118 Seguin St, San Antonio, TX,78208
34617,160,Pretzelmaker (6909 N Loop 1604 E),,,"Fast Food, Bakery, Desserts",$,29.5970323,-98.3504534,6909 N Loop 1604 E Ste. 2032, San Antonio, TX,78247
34618,142,Russo's Italian Family Meals (San Antonio),,,"Italian, Pasta, Comfort Food, Family Meals, Wings",$,29.61233,-98.59446,17631 La Cantera Pkwy, San Antonio, TX,78257
34619,134,Menchie's Frozen Yogurt (999 E Basse Rd #177),4.9,12,"Ice Cream &amp; Frozen Yogurt, Comfort Food, Desserts",$,29.49797,-98.4686,999 E Basse Rd #177, San Antonio, TX,78209
34620,129,Helados Aranda,,,"Ice Cream &amp; Frozen Yogurt, Comfort Food, Desserts",$$,29.55609,-98.39954,12728 Nacogdoches Rd, San Antonio, TX,78217
34621,127,7-Eleven (11110 IH 35N),,,"Everyday Essentials, Convenience, Home &amp; Personal Care, Snacks, Pizza, American",$,29.53954,-98.3788,11110 Ih 35N, San Antonio, TX,78233
34623,114,L'Orenta Nuts,,,"Specialty Foods, Gift Store",$,29.53379,-98.45018,2564 MacArthur View 101, San Antonio, TX,78217
34624,106,Grimaldi's Pizzeria (22810 US Highway 281 N Ste 105),4.6,106,"Italian, pizza, Comfort Food, Family Friendly",$$,29.65392931,-98.44792492,22810 Highway 281 N Ste 105, San Antonio, TX,78259
34625,105,Fat Tummy Empanadas,4.7,27,"Comfort Food, Street Food, Argentinian",$,29.4280167,-98.5279523,2922 W. Commerce St, San Antonio, TX,78207
34626,98,Señor Fish Seafood Bar,4.6,10,"Seafood, Mexican, Tacos, South American, Healthy",$$,29.4441,-98.47696,1915 Broadway, San Antonio, TX,78215
34627,96,Naara Cafe,4.7,29,Middle Eastern,$$,29.5303344,-98.5647002,9329 Wurzbach Rd, San Antonio, TX,78240
34628,82,Kulture Kafe,4.9,138,"Coffee and Tea, Bagels, Breakfast and Brunch",,29.41247,-98.48806,1112 South Saint Mary's Street, San Antonio, TX,78210
34629,44,Taco Palenque (Medical Center),4.6,200,"Mexican, Latin American, New Mexican, Fast Food, Family Meals, Group Friendly",$,29.5270353,-98.5589365,3847 Parkdale Dr, San Antonio, TX,78229
34630,39,"Charleys Cheesesteaks and Wings - Walmart - SE Loop 410, TX",4.4,70,"Sandwich, American, Comfort Food",$,29.40062,-98.38858,2100 South East Loop 410, San Antonio, TX,78220
34631,38,Embers Wood Fire Grill &amp; Bar (North Loop),4.6,38,"Burgers, American, Sandwiches",$,29.6109288,-98.4810534,819 N Loop 1604 E, San Antonio, TX,78232
34633,32,Taco Cabana (8105 Fourwinds Dr),4.4,66,"Mexican, Tex Mex, Breakfast and Brunch, Family Meals",$,29.510848,-98.395458,8105 Fourwinds Dr, San Antonio, TX,78239
34634,31,Five Guys TX-0405 260 E. Basse Rd,4.6,200,"American, Burgers, Fast Food",$,29.4944316,-98.4790181,260 E Basse St Suite 107, San Antonio, TX,78209
34635,23,Cosmic Wings (Windsor Park),4.6,14,"American, Bar Food, Wings, Fast Food, Chicken, Family Meals, Exclusive to Eats, Comfort Food",$,29.50687,-98.3974,7880 IH35 North, San Antonio, TX,78218
34636,21,225° Urban Smoke,4.8,57,"BBQ, American, Salads, Sandwiches, Soul Food",,29.48538,-98.428,1015 Rittiman Road, San Antonio, TX,78218
34637,17,Buffalo Wild Wings GO (4230 N Foster Rd),4.4,178,"wings, American, Comfort Food",$$,29.46685,-98.35927,4230 North Foster Road, San Antonio, TX,78244
34638,7,Mamma Lou's Soul Food Kitchen,4.7,100,"Soul Food, American, Chicken",,29.510447,-98.393005,4929 Walzem Rd, San Antonio, TX,78218
34639,208,Senor Mango Ice Cream,4.7,75,"Ice Cream + Frozen Yogurt, Desserts",$,29.5142543,-98.5255473,5112 West Ave, San Antonio, TX,78213
34640,202,La Mejico Express,,,"Desserts, Bakery, Mexican",$,29.5918171,-98.5122629,16505 Blanco Rd, San Antonio, TX,78248
34641,201,Chicago Bagel &amp; Deli,4.9,75,"Breakfast and Brunch, Deli, Sandwiches, Bagels, Salads, Hot Dog, Coffee and Tea",$,29.5409731,-98.5515406,10918 Wurzbach Rd, San Antonio, TX,78230
34644,199,Dulce Victoria Desserts,,,"Desserts, Bakery, Pastry",$,29.4605945,-98.5224276,1717 Fredericksburg Rd, San Antonio, TX,78201
34645,198,Pretzelmaker (17238 Bulverde Rd),,,"Bakery, Desserts, Fast Food, Drinks",$,29.59501,-98.41739,17238 Bulverde Rd, San Antonio, TX,78247
34646,197,Jamba Juice (San Pedro),,,"Juice and Smoothies, Breakfast and Brunch, Bowls, Healthy",,29.51829,-98.49548,7400 San Pedro Ave, San Antonio, TX,78216
34647,196,The Baked Bird,,,"Breakfast and Brunch, Coffee and Tea, Bakery",,29.54678,-98.47981,1003 East Nakoma Street, San Antonio, TX,78216
34648,194,Panifico Bake Shop,4.9,16,"Bakery, Cupcakes, Comfort Food",$,29.4348397,-98.5416716,602 N.W. 24th, San Antonio, TX,78207
34649,193,Corner Bakery (255 E Basse Rd Ste 100),4.7,200,"Breakfast and Brunch, Family Meals, Sandwich, Salads, Pasta, Cafe",$$,29.49226658,-98.4811297,255 E Basse Rd Ste 100, San Antonio, TX,78209
34650,191,Commonwealth Coffeehouse &amp; Bakery (Hemisfair),,,"American, Breakfast and Brunch, Coffee and Tea",,29.41913,-98.48418,611 Hemisfair Boulevard, San Antonio, TX,78205
34651,192,Commonwealth Coffeehouse &amp; Bakery Evergreen,,,"Coffee and Tea, American, Breakfast and Brunch, Bakery",,29.44249,-98.4965,224 West Evergreen Street, San Antonio, TX,78212
34652,190,Wholesome Eating Gluten Free Bakery and Restaurant,,,"American, Desserts, Burgers, Pizza",$$,29.57192,-98.51791,13455 Blanco Road, San Antonio, TX,78216
34653,189,Twin Sister's Bakery and Cafe,,,"Healthy, Pastry, Salads, Breakfast and Brunch",,29.4875814,-98.4587057,6322 N New Braunfels Ave, San Antonio, TX,78209
34654,179,"Marco's Pizza (822 Evans Rd., Ste.102)",4.7,51,"pizza, Sandwich, Salads",$,29.64274,-98.48114,822 Evans Rd. Ste.102, San Antonio, TX,78258
34655,170,Bill Miller Bar-B-Q (Thousand Oaks Dr),4.6,69,Family Meals,$$,29.57778,-98.44078,2911 Thousand Oaks, San Antonio, TX,78247
34656,155,Pasha Mediterranean Grill (Wurzbach),4.8,200,"Mediterranean, Family Friendly",$$,29.5296686,-98.5641544,9339 Wurzbach Rd, San Antonio, TX,78240
34657,128,Whataburger (8002 Fredericksburg Rd),4.5,116,"Burgers, Fast Food, Burgers, Sandwiches, American",$$,29.51337,-98.56921,8002 Fredericksburg Rd, San Antonio, TX,78229
34659,112,Salata Quarry Village,4.8,130,"Healthy, Salads, Vegan",$,29.49336,-98.4788,250 E. Basse Rd, San Antonio, TX,78209
34661,105,Small Town Nutrition,,,"Bakery, Juice and Smoothies, Coffee and Tea",$,29.51016,-98.38545,5370 Walzem Road, San Antonio, TX,78218
34663,93,Mellow Mushroom (San Antonio),4.6,48,"Pizza, Salads, Wings, Family Meals, Healthy",$$,29.6098054,-98.4900628,115 N Loop 1604 E, San Antonio, TX,78258
34664,88,Capos Pizzeria (8522 Broadway Street #105),4.3,64,"Italian, Pasta, Sandwich",,29.51783,-98.4625,8522 Broadway St #105, San Antonio, TX,78217
34665,84,CAVA (LINCOLN HEIGHTS),4.8,200,"Dinner, Healthy, Salads",$,29.49797,-98.4686,999 E Basse Rd #125, San Antonio, TX,78209
34668,77,Arby's (13601 Nacogdoches Rd.),4.6,90,"American, Fast Food, Sandwich",$,29.56531,-98.38885,13601 NACOGDOCHES RD., San Antonio, TX,78217
34670,65,Potbelly Sandwich Shop (Broadway | 450),4.7,197,"Deli, Salads, Sandwich, Healthy",$,29.45439,-98.47102,3006 Broadway Ste. 101, San Antonio, TX,78209
34671,57,Chipotle Mexican Grill (6302 FM 78),4.6,169,"Healthy, Mexican",$,29.479172,-98.36247625,6302 FM 78, San Antonio, TX,78244
34673,53,IHOP (14424 San Pedro),4.4,157,"American, Breakfast and Brunch, burger, Comfort Food, Dinner, Omelette, salad, Traditional American, Family Meals",$,29.5731217,-98.4785662,14424 San Pedro, San Antonio, TX,78232
34674,50,Amy's Ice Creams (San Antonio),5,23,"Ice Cream + Frozen Yogurt, Desserts, Family Meals",$,29.4960006,-98.4801718,255 E Basse Rd, San Antonio, TX,78209
34675,45,Scooped Cookie Dough Bar,4.5,11,Desserts,$,29.6155,-98.3171,18771 Farm-to-Market 2252, San Antonio, TX,78266
34676,44,Taco Cabana (11722 IH 35 N),4.5,41,"Mexican, Tex Mex, Breakfast and Brunch, Family Meals",$,29.5462341,-98.366366,11722 IH 35 N, San Antonio, TX,78233
34677,42,Auntie Anne's (7400 San Pedro Avenue),,,"Bakery, Comfort Food, Desserts, Pretzel",$,29.51838,-98.49789,7400 San Pedro Avenue, San Antonio, TX,78216
34678,35,BellaRo Cupcakery &amp; Sweets,,,"Bakery, Cakes, Desserts",,29.62526398,-98.49625674,19141 Stone Oak Parkway, San Antonio, TX,78258
34679,19,Shipley Do-Nut (14088 Nacogdoches Rd),4.3,26,"American, Bakery, Desserts",$,29.57015,-98.382,14088 Nacogdoches Rd, San Antonio, TX,78247
34680,18,Crumbl Cookies (255 E Basse Road Suite 152),4.7,61,"Snacks, Bakery, Pastry, Desserts, Desserts",$$,29.49356,-98.47978,255 E Basse Road Suite 152, San Antonio, TX,78209
34681,15,Nadler's Bakery &amp; Deli,,,"Deli, Desserts, Bakery",$$,29.4931663,-98.5691139,1621 Babcock Rd, San Antonio, TX,78229
34682,13,Twin Sisters Bakery &amp; Cafe,,,"Italian, Pasta, Comfort Food",$$,29.4875652,-98.4587324,6322 N New Braunfels Ave, San Antonio, TX,78209
34685,10,Southern Roots Vegan Bakery,,,"Black-owned, Desserts, Cupcakes, Pastry",,29.362536,-98.493194,6208 South Flores Street, San Antonio, TX,78214
34687,9,Baklovah Bakery ,,,"Desserts, Bakery, Coffee and Tea, Middle Eastern, European",$,29.5303213,-98.5647122,9329 Wurzbach Rd, San Antonio, TX,78240
34688,188,Taqueria Datapoint (Gramercy),,,"Mexican, Latin American, New Mexican",$$,29.461,-98.5232,1702 W Gramercy Pl, San Antonio, TX,78201
34689,187,Winner Winner Chicken Dinner,,,"Sandwiches, Chicken, Comfort Food, Fried Chicken",,29.51848,-98.43108,2015 Northeast Loop 410, San Antonio, TX,78217
34690,186,El Jefe,,,"Burgers, American, Sandwiches",$,29.44847,-98.48807,2407 North Saint Marys Street, San Antonio, TX,78212
34691,184,Chick-fil-A  (1350 Austin Hwy),4.9,200,"American, Fried Chicken, Family Meals, Southern, Sandwich, Fast Food",$,29.49058,-98.43937,1350 Austin Hwy, San Antonio, TX,78209
34692,183,Ghost Kitchen SA,,,"American, Burgers, Wings",,29.51848,-98.43108,2015 Northeast Loop 410, San Antonio, TX,78217
34693,181,Carmen's Mexican Restaurant,,,"Mexican, Latin American, New Mexican",$$,29.49874,-98.34913,7030 Branching Court, San Antonio, TX,78239
34694,180,Teran's Restaurant,,,"Mexican, Latin American, New Mexican",$$,29.42469,-98.40901,4403 E Houston St, San Antonio, TX,78220
34696,178,Wing Master,,,"Wings, American, Chicken",,29.51848,-98.43108,2015 Northeast Loop 410, San Antonio, TX,78217
34697,174,Taco Cabana (5115 Rigsby ),4.4,49,"Mexican, Tex Mex, Breakfast and Brunch, Family Meals",$,29.3986009,-98.3909779,5115 Rigsby, San Antonio, TX,78222
34700,167,Little Taco Factory(1510 McCullough Ave),,,"Mexican, Latin American, New Mexican",$$,29.4431432,-98.4916301,1510 McCullough Ave, San Antonio, TX,78212
34702,164,Hometown Burger (5423 Evers Rd.),4.8,13,"Burgers, American, Sandwiches",$,29.48611,-98.59384,5423 Evers Rd., San Antonio, TX,78238
34703,160,Hometown Burger (Roosevelt),4,22,"Burgers, American, Sandwiches",$,29.35705,-98.48088,3436 Roosevelt, San Antonio, TX,78214
34704,159,FREAKING GOOD PIZZA (2620 South Presa Street),,,"American, Pizza, Italian",$$,29.39549,-98.48136,2620 South Presa Street, San Antonio, TX,78210
34705,157,Poblano's On Main,4.2,13,Mexican,$,29.4242501,-98.4942198,115 S Main Plaza, San Antonio, TX,78205
34706,149,Fresh Donut,,,"Breakfast and Brunch, American, Sandwiches",$$,29.48948,-98.4418,1302 Austin Highway, San Antonio, TX,78209
34707,148,Hometown Burger (1922 Culebra Rd.),4.3,20,"Burgers, American, Desserts",$,29.44612,-98.53904,1922 Culebra Rd., San Antonio, TX,78201
34708,147,Jesma Fine Foods,5,15,"Mexican, Latin American, New Mexican, Breakfast and Brunch, American",$,29.3978211,-98.4387585,1722 Rigsby Avenue, San Antonio, TX,78210
34709,142,Tia's Taco Hut (St. Mary's),4.3,13,"Mexican, Breakfast and Brunch, Tacos",$,29.43435,-98.48596,1203 North Saint Marys Street, San Antonio, TX,78215
34711,140,Rios Meat Market,4.2,62,"Breakfast and Brunch, American, Sandwiches",$,29.3463691,-98.5334249,8030 S Zarzamora St, San Antonio, TX,78224
34712,137,Hometown Burger (11910 Blanco Rd.),4.4,22,"Burgers, American, Sandwiches",$,29.54959,-98.51048,11910 Blanco Rd #101, San Antonio, TX,78216
34713,136,SA seafood,4.4,93,"Seafood, American, Southern",,29.5638392,-98.5866372,5222 De Zavala Rd, San Antonio, TX,78230
34714,134,Teka Molino,4.4,22,"Mexican, Burritos, Tacos, Quesadillas",$,29.514771,-98.499701,7231 San Pedro Ave, San Antonio, TX,78216
34715,133,Long John Silver's (3318 SE Military Dr),4.3,44,"American, Family Meals, Fish and Chips, Seafood, Chicken",$,29.3513,-98.432567,3318 SE Military Dr., San Antonio, TX,78223
34717,130,Cafe Rosa 3,4.5,39,"Mexican, Breakfast and Brunch",$,29.4854434,-98.559754,2817 Hillcrest Dr, San Antonio, TX,78201
34718,124,Teka Molino 2,4.6,45,"Mexican, Burritos, Tacos, Quesadillas",$$,29.485138,-98.42882,1007 Rittiman Rd, San Antonio, TX,78218
34719,120,El Taco - Stone Oak,4.7,32,"Mexican, Family Meals, New Mexican",$,29.627486,-98.494453,19202 Stone Oak Pkwy, San Antonio, TX,78258
34720,116,Hash Vegan Eats,4.8,49,"Vegetarian, Vegan, Healthy",,29.37603,-98.4994,5007 South Flores Street, San Antonio, TX,78214
34721,113,Jimmy Buffett's Margaritaville (San Antonio),3.9,10,"Bar Food, American, Traditional American, Family Meals",$,29.4232731,-98.4844152,849 E Commerce St, San Antonio, TX,78205
34722,112,Papa Johns (12642 Nacogdoches Rd),4.5,23,"Pizza, Wings, Sandwiches, Desserts, American, Traditional American, Fast Food",$,29.5551196,-98.4007624,12642 Nacogdoches Rd, San Antonio, TX,78217
34723,111,Regio Cafe,4.6,39,"Breakfast and Brunch, Mexican",$,29.4453197,-98.491601,1706 McCullough Ave, San Antonio, TX,78212
34724,107,Duck Donuts (11703 Huebner Rd Ste 113),4.8,77,"Desserts, Breakfast and Brunch",$$,29.5518327,-98.5731337,11703 Huebner Rd Ste 113, San Antonio, TX,78230
34725,104,Firehouse Subs (1802 N. Loop 1604 E. #104),4.6,89,"Sandwich, Deli, Salads, Healthy",$,29.606919,-98.4631027,1802 N. Loop 1604 E. #104, San Antonio, TX,78232
34726,95,Cici's (San Pedro),4.4,21,"Pizza, Wings",$,29.5070751,-98.4983898,6900 San Pedro Ave, San Antonio, TX,78216
34730,81,Stuffed,4.5,24,"Burritos, Mexican, Tex Mex",,29.488666,-98.58388,4939 Northwest Loop 410, San Antonio, TX,78229
34731,80,Super Donut,4.8,22,"Burgers, American, Sandwiches",$,29.4663341,-98.3578704,6658 Summer Fest Dr, San Antonio, TX,78244
34732,76,Rusty Taco (17026 Bulverde Rd),4.2,42,"Mexican, South American",$,29.59781,-98.41795,17026 Bulverde Road, San Antonio, TX,78247
34733,75,Zedric's Fit with Flavor (The Colonnade),4.6,44,"Healthy, Gluten Free, Breakfast and Brunch",$,29.5333141,-98.5611272,9873 I-10, San Antonio, TX,78230
34735,68,PAWSitively Sweet Bakery,,,"pet supplies, Retail",$,29.50331,-98.50735,5501 Blanco Rd, San Antonio, TX,78216
34736,64,Bobbie's Cafe,4.8,32,"Burgers, American, Sandwiches, Tacos",,29.35427,-98.48965,6728 S Flores St, San Antonio, TX,78221
34738,51,Wild Burger (8450 N I-35),4.5,20,Burgers,$$,29.51405,-98.39627,8450 N Interstate 35, San Antonio, TX,78239
