id,position,name,score,ratings,category,price_range,lat,lng,address,city,state,zip_code
34961,17,Kosta's Greek Food,,,"Mediterranean, Greek, Vegetarian",$$,29.55451,-98.40113,12606 Nacogdoches Road, San Antonio, TX,78217
34962,16,Wasabi,4.6,74,"Sushi, Asian, Japanese",,29.5341352,-98.5634559,9921 I-10, San Antonio, TX,78230
34963,15,Kiku Garden,,,"Sushi, Asian, Japanese",$$,29.48276,-98.40193,4527 Goldfield, San Antonio, TX,78218
34964,12,Godai Sushi Bar &amp; Japanese Restaurant,4.6,77,"Japanese, Sushi, Rolls",$$,29.54176,-98.51405,11203 West Avenue, San Antonio, TX,78213
34966,6,Bubba Gump Shrimp Co (406 Navarro St),3.6,20,"Seafood, American, Southern, Healthy, Desserts",$,29.4253674,-98.4896078,406 Navarro St, San Antonio, TX,78205
34967,5,Mediterranean Turkish Grill,4.7,58,Mediterranean,$$,29.5161599,-98.4928404,8507 McCullough Ave, San Antonio, TX,78216
34968,3,Leeann Chin (11911 Crosswinds Way),,,"Asian, Chinese, Noodles, Rice Dishes",$,29.54784,-98.37637,11911 Crosswinds Way, San Antonio, TX,78233
34969,190,Sabor de México,,,"Mexican, Latin American, New Mexican, Breakfast and Brunch",$,29.491444,-98.43973,1367 Austin Hwy, San Antonio, TX,78209
34971,188,Southtown Barbacoa,4.7,19,"Mexican, Latin American",,29.40443,-98.49538,317 Probandt, San Antonio, TX,78204
34972,187,The Point Panaderia &amp; Cafe,4.8,13,"Breakfast and Brunch, Latin American, Asian",$$,29.527685,-98.393239,9735 N Interstate 35, San Antonio, TX,78233
34973,185,Tacos El Guero Loko LLC,4.7,65,"Mexican, Latin American, Tacos",,29.60227,-98.5083,17595 Blanco Road, San Antonio, TX,78232
34974,184,Rios Barbacoa,4.8,106,"Mexican, Latin American, New Mexican, BBQ",$,29.49005841,-98.59890447,5745 Evers Rd, San Antonio, TX,78238
34975,183,Tacos El Regio -  Nacogdoches,4.5,168,"Mexican, Latin American, New Mexican",$,29.5570533,-98.3994637,12757 Nacogdoches Road, San Antonio, TX,78217
34976,182,Sarah's Barbacoa,4.4,51,"Mexican, Latin American, New Mexican",$,29.56271,-98.60999,6330 De Zavala Rd, San Antonio, TX,78249
34977,181,Birria Barrio,4.7,121,"Mexican, Latin American, New Mexican, Tacos, Mac and Cheese",,29.394902,-98.481135,2710 South Presa Street, San Antonio, TX,78210
34979,178,The Burger Den (9550 I-10 West),4.6,53,"American, Burgers, Comfort Food, Vegetarian Friendly, Fast Food",$$,29.52913,-98.56125,9550 I-10 West, San Antonio, TX,78230
34980,179,Mi Rodeo,4.4,109,"Mexican, Latin American, New Mexican, Family Meals",$,29.3978669,-98.3868904,5310 Rigsby Ave, San Antonio, TX,78222
34981,175,Dona Tota (Southside),4.8,46,"Mexican, Latin American, New Mexican",,29.35102,-98.45993,2230 Southeast Military Drive #102, San Antonio, TX,78223
34982,173,Fusion Food,,,"Pizza, American, Italian",$,29.51575,-98.57114,8132 Fredericksburg Road, San Antonio, TX,78229
34984,171,Luciano's - South Park Mall,4.1,19,"Pizza, American, Italian, Wings, Pasta, Family Meals",$,29.355162,-98.52957,2310 S.W Military Dr Ste #107, San Antonio, TX,78224
34985,170,Delicious Tamales (1330 Culebra Rd.),4.5,16,"Mexican, Latin American, New Mexican",,29.44532,-98.53117,1330 Culebra Road, San Antonio, TX,78201
34986,169,Tejas Cafe,,,"Coffee and Tea, American, Breakfast and Brunch",$$,29.54967,-98.3758,12122 Oconnor Rd, San Antonio, TX,78233
34988,165,Tia's Taco Hut (Babcock Rd.),3.9,13,"Mexican, Latin American, New Mexican",$,29.52267,-98.59975,5730 Babcock Road, San Antonio, TX,78240
34989,163,4 Seasons Yogurt,5,25,"Ice Cream + Frozen Yogurt, Desserts, Comfort Food",$,29.6096729,-98.5114208,1207 Texas 1604 Access Rd, San Antonio, TX,78258
34990,161,K&amp;K Donuts,5,23,"American, Sandwiches, Dount, Breakfast and Brunch, Coffee and Tea",,29.579168,-98.586598,5138 UTSA Boulevard, San Antonio, TX,78249
34991,157,Birotes Tortas Ahogadas (West Martin),4.6,92,"Mexican, Latin American, New Mexican, Tacos, Tex Mex, Hot Dog, Burgers",$,29.43185,-98.52555,3004 West Martin Street, San Antonio, TX,78207
34992,156,Las Palapas (O’Connor),4.4,72,"Mexican, Latin American, Comfort Food",$,29.60113,-98.40509,4438 North Loop 1604 East, San Antonio, TX,78247
34993,155,Alamo Pizza &amp; Wings,4.5,53,"Pizza, American, Italian",,29.38572,-98.53274,3938 S Zarzamora St, San Antonio, TX,78225
34994,154,La Unica Birotes Restaurant (Goliad),4.3,59,"Mexican, Latin American, Tex Mex, Tacos, Tamale, Burgers, Breakfast and Brunch, Hot Dog",,29.35694,-98.43363,2622 Goliad Rd., San Antonio, TX,78223
34997,146,Tink-A-Tako (2511 SE Military Dr),4.3,63,"Mexican, Latin American",$,29.3529388,-98.4531714,2511 SE Military Dr, San Antonio, TX,78223
34998,145,Sandwich De Paris,4.9,11,"Sandwiches, American, Healthy",$$,29.5008065,-98.5765238,7220 Louis Pasteur Drive, San Antonio, TX,78229
34999,143,Pan &amp; Coffee,4.9,67,"Coffee and Tea, American, Breakfast and Brunch",,29.63223,-98.49502,19298 Stone Oak Parkway, San Antonio, TX,78258
35000,138,Los Generales (16216 Nacogdoches Road),4.6,49,"Mexican, Soup, Breakfast and Brunch, Latin American, New Mexican, Asado, Steak, Chicken, Soup, Burritos, Tacos, Tex Mex, American",$,29.58765,-98.35842,16216 Nacogdoches Road, San Antonio, TX,78247
35001,137,Goombas Pizzeria,4.6,45,"American, Pizza",$,29.4930549,-98.5518653,4522 Fredericksburg Rd, San Antonio, TX,78201
35002,133,El ranchero mexican restaurant,4.7,30,"Mexican, Latin American, New Mexican, Exclusive to Eats",$,29.688202,-98.47651,26180 Canyon Golf Road, San Antonio, TX,78260
35003,130,Ay Chiwawa (1604 E),4.7,66,"Mexican, New Mexican, Latin American",,29.610222,-98.469448,1615 N Loop 1604 E, San Antonio, TX,78232
35004,129,Paul's Pizza Roma,4.1,39,"Italian, Salads, Pasta, Healthy",$$,29.502044,-98.5601247,5137 Fredericksburg Rd, San Antonio, TX,78229
35005,127,Vida Mia Mexican Cuisine,4.8,44,"Mexican, Latin American, New Mexican",$,29.625677,-98.49585,19141 Stone Oak Parkway #803, San Antonio, TX,78258
35006,126,Cazadores Mexican Restaurant,4.8,34,"Mexican, Latin American, New Mexican, Tacos, Burritos, Soup, Seafood, Tex Mex",$,29.48494,-98.43101,927 Rittiman Rd, San Antonio, TX,78209
35007,124, Las Adelitas El Pacifico,4.7,13,"Mexican, Latin American, New Mexican, South American, Fish and Chips, Seafood, Burritos, Tacos, Tex Mex, Soup",$,29.56656,-98.38627,13860 Nacogdoches Road, San Antonio, TX,78217
35008,123,Con Huevos Tacos,4.7,48,"Mexican, Latin American, New Mexican",$,29.4253145,-98.4719507,1629 E Houston St, San Antonio, TX,78202
35009,122,Urban Bricks Pizza (19141 Stone Oak Pkwy Suite 101),4.3,86,"Pizza, American, Italian",$$,29.62472,-98.49592,19141 Stone Oak Parkway, San Antonio, TX,78258
35010,119,Demo's Greek Food (Stone Oak),4.8,139,"Sandwiches, American, Healthy, Greek, Mediterranean",$,29.60918,-98.51074,1205 N Loop 1604 W., San Antonio, TX,78258
35013,116,Tommy's (Wurzbach Parkway),4.6,126,"Mexican, Latin American, New Mexican",$,29.5574,-98.51863,938 Wurzbach Parkway #109, San Antonio, TX,78231
35014,115,El Taco De Jalisco,4.5,89,"Mexican, Latin American, New Mexican",,29.515208,-98.53547,4407 Vance Jackson Rd, San Antonio, TX,78230
35015,114,Susana's Mexican Restaurant &amp; Catering,4.8,23,"Mexican, Latin American, New Mexican",$,29.4008784,-98.5306673,2223 S Zarzamora St, San Antonio, TX,78207
35016,113,IHOP (17242 Autry Road),4,32,"American, Comfort Food",$,29.59854,-98.4213,17242 Autry Pond Road, San Antonio, TX,78247
35017,112,Rami's Pizza,4.5,35,"Pizza, American, Italian",,29.54498,-98.41191,4189 Naco Perrin Blvd, San Antonio, TX,78217
35018,111,Eddie's Taco House,4.6,151,"Mexican, New Mexican, Latin American, Tex Mex, Local Specialities",$,29.4106482,-98.5058014,402 W Cevallos, San Antonio, TX,78204
35019,110,Tommy's Restaurant (Silicon Dr),4.9,150,"Mexican, Latin American, New Mexican",$,29.56567,-98.59349,12830 Silicon Dr., San Antonio, TX,78249
35020,109,LISA'S MEXICAN RESTAURANT,4.4,44,"Mexican, Latin American, New Mexican",$,29.4559245,-98.5543323,815 Bandera Rd, San Antonio, TX,78228
35021,108,Pizza Italia,4.6,58,"Pizza, American, Italian, Wings",$,29.5754934,-98.4392544,3023 Thousand Oaks Dr #101, San Antonio, TX,78247
35022,107,Macs &amp; Stacks (La Cantera),4.2,40,"American, Burgers, Comfort Food, Pasta, Sandwich",$$,29.5932,-98.61091,15900 La Cantera Parkway, San Antonio, TX,78256
35023,105,Tia's Taco Hut (Blanco Rd.),4.6,17,"Mexican, Latin American, New Mexican",$,29.52385,-98.50412,7214 Blanco Road, San Antonio, TX,78216
35024,106,Goomba’s pizzeria,4.7,117,"Pizza, American, Italian",,29.52398,-98.504706,7216 Blanco Road, San Antonio, TX,78216
35025,104,Bad-Ass Breakfast Burritos (Stone Oak),4.5,83,"Burgers, American, Sandwiches",$,29.64938,-98.45163,20907 Stone Oak Parkway, San Antonio, TX,78258
35026,103,Embers Wood Fire Grill &amp; Bar,4.9,21,"Burgers, American, Sandwiches",$$,29.5313334,-98.5638968,9818 I-10, San Antonio, TX,78240
35027,102,El Taco Grill (Huebner Rd ),4.6,200,"Mexican, American",$,29.6224103,-98.5125804,19211 Huebner Rd, San Antonio, TX,78258
35028,101,Tommy's Restaurant (Medical Center),4.7,200,"Mexican, Latin American, New Mexican",$,29.52513,-98.56865,8823 Wurzbach Rd, San Antonio, TX,78240
35029,96,Frontier Burger,,,"Breakfast and Brunch, American, Sandwiches",$$,29.51591,-98.46262,838 NE Lp 410, San Antonio, TX,78209
35031,100,La Coronela Mexican Restaurant,4.7,28,"Mexican, Latin American, New Mexican, Family Meals",$,29.4214191,-98.4615301,201 N New Braunfels Ave, San Antonio, TX,78202
35034,91,Mark's Outing,4.5,26,"Burgers, American, Sandwiches, Seafood, Bar Food, Cafe, Wings",$,29.419647,-98.470772,1624 E Commerce St, San Antonio, TX,78205
35035,90,Tacos Chagos,4.5,64,"Mexican, Latin American, New Mexican",$,29.547888,-98.4103563,11827 Perrin Beitel Road, San Antonio, TX,78217
35036,89,Tommy's Restaurant (IH35 &amp; Nogalitos),4.7,200,"Mexican, Breakfast and Brunch, Tacos",$,29.40149,-98.51124,1205 Nogalitos, San Antonio, TX,78204
35038,86,The Hut Diner,4.7,16,"American, Diner",$,29.459837,-98.521047,1610 Fredericksburg Rd, San Antonio, TX,78201
35039,85,Doña Tota (Northside),4.5,42,"Mexican, Latin American",$,29.5097885,-98.4997349,7053 San Pedro Ave, San Antonio, TX,78216
35040,84,Cicis Pizza (6900 San Pedro Ave),,,"pizza, American, Sandwiches",$,29.50606,-98.49858,6900 San Pedro Avenue, San Antonio, TX,78216
35041,83,Rolando's Super Tacos No 1,4.4,200,"Mexican, Latin American, New Mexican",$,29.466758,-98.508629,919 West Hildebrand Avenue, San Antonio, TX,78201
35042,81,Boss Bagels,4.7,91,"Breakfast and Brunch, American, Sandwiches",$,29.48965,-98.45912,6458 N New Braunfels Ave, San Antonio, TX,78209
35043,79,Blanco BBQ,4.6,200,"Burgers, American, Sandwiches, BBQ, Family Meals",$$,29.5652696,-98.5207704,13259 Blanco Rd, San Antonio, TX,78216
35045,75,Which Wich (13429 San Pedro),4.5,51,"American, Sandwich",$,29.5650853,-98.4840428,13429 San Pedro Ave, San Antonio, TX,78216
35046,80,Tommy's Restaurant (San Pedro),4.6,149,"Mexican, Latin American, New Mexican, Tacos, Breakfast and Brunch",$,29.49739,-98.49865,6510 San Pedro Ave, San Antonio, TX,78216
35048,72,Tip Top Cafe,4.5,43,"American, Seafood",$$,29.470117,-98.531185,2814 Fredericksburg Rd, San Antonio, TX,78201
35049,73,Buffalo Wild Wings GO (508 Chestnut St),4.8,26,"Burgers, American, Sandwiches, Wings, Chicken, Fast Food",$,29.42669,-98.47906,508 Chestnut, San Antonio, TX,78202
35050,70,El Paraiso De Jalisco #2 ,4.5,74,"Mexican, Latin American, New Mexican",,29.56219,-98.38224,13550 O'Connor Road, San Antonio, TX,78233
35051,69,Barbecue Station,,,"BBQ, American, Burgers",$$,29.51496461,-98.43940803,1610 Northeast Interstate 410 Loop, San Antonio, TX,78209
35052,68,Firehouse Subs (The Colonnade III),4.4,39,American,$,29.5359586,-98.565733,9961 Interstate 10 Frontage Rd, San Antonio, TX,78230
35053,67,Maple Street Biscuit Company (Quarry Village),4.7,50,"American, Breakfast &amp; Brunch, Comfort Food",$$,29.49533,-98.47913,290 East Basse Road, San Antonio, TX,78209
35054,64,Marco's Pizza (5203 Eisenhauer Rd),4.6,160,"Pizza, American, Italian",$,29.4973,-98.3837,5203 Eisenhauer Rd, San Antonio, TX,78260
35056,62,Las Palapas (4802 Walzem Road),4.4,56,"Black-owned, Mexican, Latin American, New Mexican, Family Meals",$,29.5098288,-98.3967802,4802 Walzem Road, San Antonio, TX,78218
35057,61,Big'z Burger Joint,4.7,34,"Burgers, American, Sandwiches",$,29.6069486,-98.5290337,2303 N Loop 1604 W, San Antonio, TX,78258
35058,59,Little Jamaica Foods Bar &amp; Grill,4.4,75,"Caribbean, Seafood, Latin American",,29.51017,-98.38168,5490 Walzem Rd, San Antonio, TX,78218
35060,57,Dog Haus Biergarten – Stone Oak ,4.6,78,"Burgers, American, Hot Dog",,29.64938,-98.45163,20907 Stone Oak Parkway, San Antonio, TX,78258
35061,54,Shake Shack (Park North),4.7,200,"American, Burgers",$,29.5173826,-98.4998416,7411 San Pedro Avenue, San Antonio, TX,78216
35062,53,Chicago Hot Dogs,4.8,36,"American, Burgers, Sandwiches",,29.55821762,-98.46170794,12914 Jones Maltsberger, San Antonio, TX,78247
35063,50,Dignowity Meats On Houston Street,4.7,84,American,$,29.4252977,-98.4715268,1701 E Houston St, San Antonio, TX,78202
35064,48,Lennys Grill &amp; Subs (17910 Bulverde Road),4.7,68,American,$,29.6039365,-98.4185054,17910 Bulverde Rd, San Antonio, TX,78259
35065,47,Raising Cane's Chicken Fingers  (8402 Broadway St.),4.8,194,"Comfort Food, American, Chicken",$$,29.515244,-98.46498,8402 Broadway, San Antonio, TX,78209
35066,44,Babe's Old Fashioned Food (Fredericksburg Rd.),4.3,91,"American, Family Meals",$,29.4904493,-98.552062,4535 Fredericksburg Rd, San Antonio, TX,78201
35067,43,Golden Chick (4110 N Foster Rd),4.5,67,"Fast Food, Wings, American, Family Meals",$,29.46779,-98.35916,4110 N FOSTER RD, San Antonio, TX,78244
35069,37,Wendy's  (11919 PERRIN-BEITEL),4.3,70,"American, Burgers, Fast Food",$,29.548904,-98.408904,11919 PERRIN-BEITEL, SAN ANTONIO, TX,78217
35070,36,Dairy Queen (9726 Perrin Beitel),4.2,102,"Ice Cream + Frozen Yogurt, Burgers, Chicken, American",$,29.528778,-98.41062,9726 Perrin Beitel, San Antonio, TX,78217
35071,35,BJ's Restaurant &amp; Brewhouse (San Antonio #480),4.4,190,"American, Burgers, Pizza, Family Meals",$$,29.6495,-98.4486,22410 Highway 281 North, San Antonio, TX,78259
35072,33,Bill Miller Bar B Q -5113 WALZEM RD,4.1,69,"BBQ, American, Comfort Food, Family Meals",$$,29.5107239,-98.3885256,5113 Walzem Road, San Antonio, TX,78239
35073,31,Al Carbon Pollos Asados,4.8,129,"Mexican, Latin American, New Mexican",$,29.5673359,-98.386617,13835 Nacogdoches Rd, San Antonio, TX,78217
35077,27,Jersey Mike's Subs (999 Ease Basse Road),4.9,160,"Sandwich, American, Comfort Food",$,29.49797,-98.4686,999 East Basse Road, San Antonio, TX,78209
35079,25,KFC (8727 Perrin Beitel),4.6,50,"American, Chicken, Comfort Food",$,29.5192,-98.41148,8727 Perrin Beitel, San Antonio, TX,78217
35080,24,Cheesy Jane's,4.3,40,"Burgers, American, Hot Dog, Salads, Sandwiches, Comfort Food, Ice Cream",,29.46506,-98.46378,4200 Broadway St, San Antonio, TX,78209
35081,20,Bush's Chicken (Nacogdoches),4.6,195,"Fast Food, American, Family Meals, Family Friendly",$,29.5655293,-98.3890692,13603 Nacogdoches Rd, San Antonio, TX,78217
35082,23,Subway #35145 ,,,"Fast Food, Sandwich, American",$,29.5465,-98.3658,11726 I-35 North, San Antonio, TX,78233
35083,19,Jack in the Box (859) 11615 N. Ih 35,3.8,135,"American, burger, Fast Food",$,29.5468462,-98.3682173,11615 N. Ih 35, San Antonio, TX,78233
35084,18,Long John Silver's (5430 Walzem Rd),4.5,100,"Seafood, American, Family Meals, Fish and Chips, Chicken",$,29.5099521,-98.3822806,5430 Walzem Road, San Antonio, TX,78218
35086,14,Sonic (11725 O'Connor Rd.),4.5,18,"Burgers, Sandwich, American, Fast Food, burger, Hot Dog, American, Sandwiches",$$,29.54777,-98.3711,11725 O'Connor Rd., San Antonio, TX,78233
35087,15,Burger King (4618 Rittiman Road),4,31,"American, burger, Fast Food, Family Meals",$,29.483627,-98.401191,4618 Rittiman Road, San Antonio, TX,78218
35092,6,Cracker Barrel Old Country Store (6330 N Interstate 35),4.4,200,"Burgers, American, Sandwiches, Family Meals",$,29.4863122,-98.4012565,6330 N Interstate 35, San Antonio, TX,78218
35096,193,Sop’s kitchen ,,,"Chinese: Other, Asian",,29.47638,-98.35937,5418 North Foster Road, San Antonio, TX,78244
35097,192,B&amp;D Ice House,,,"American, BBQ",$$,29.4139357,-98.4906558,1004 S Alamo St, San Antonio, TX,78210
35099,189,Killer Kebob (5713 Evers Rd),,,"Middle Eastern, Mediterranean, Falafel, Sandwiches, Halal",$,29.48953,-98.59832,5713 Evers Rd, San Antonio, TX,78238
35100,188,Mora Mediterranean Grill,,,"Middle Eastern, Mediterranean, Comfort Food, Vegan, Vegan Friendly",,29.52086,-98.57302,8620 Fredericksburg Road, San Antonio, TX,78240
35101,187,Dos Amigos,,,"Mexican, Steak, Kids Friendly",$,29.3628769,-98.5036429,1900 Pleasanton Road, San Antonio, TX,78214
35103,185,Figlios Pizzeria and Ristorante,,,"Italian, Pasta, Comfort Food, Salads, Sandwich, Pasta, Wings, Kids Friendly, Healthy, Family Friendly",$,29.61499,-98.315,18816 Fm 2252, San Antonio, TX,78266
35104,184,Chismosa’s Cantina y Comida Texicana,,,"Mexican, Tacos, Kids Friendly",,29.57324,-98.51631,14355 Blanco Road, San Antonio, TX,78216
35105,183,La Siberia Mexicana Inc,,,"Mexican, Vegetarian Friendly",,29.471339,-98.532403,3018 Fredericksburg Rd, San Antonio, TX,78201
35106,182,El Ceviche De Waldito,,,"Vegetarian, Mexican, Chicken, Peruvian, Kids Friendly, Healthy, Seafood, Rice-bowls, Especialidades, Seafood",$,29.4876638,-98.5968946,5526 Evers Rd, San Antonio, TX,78238
35107,181,46th St. Pizza,,,"Pizza, American, Italian, Comfort Food, Burgers, Wings, Pasta, Salads, Kids Friendly, Healthy, Exclusive to Eats",$,29.648874,-98.425402,22250 Bulverde Rd, San Antonio, TX,78259
35108,180,La Puntada Restaurant,,,"Mexican, Latin American, Salads, Kids Friendly, Healthy",$,29.3832045,-98.4561565,117 Goliad Rd, San Antonio, TX,78223
35109,178,Iron Cactus (San Antonio),,,"Mexican, Gluten Free Friendly",$$,29.4250333,-98.4909928,200 River Walk St #100, San Antonio, TX,78205
35110,177,Acenar Mexican Restaurant ,,,"Mexican, Breakfast and Brunch, Kids Friendly",$$,29.4263024,-98.4918378,146 E Houston St, San Antonio, TX,78205
35111,176,La Chiquita Paleteria Y Neveria,,,"American, Desserts, Kids Friendly",$,29.5015091,-98.4988548,6726 San Pedro Ave, San Antonio, TX,78216
35112,175,Bok Choy,,,"Kids Friendly, Asian, Asian Fusion",$,29.474074,-98.4622363,5130 Broadway St, San Antonio, TX,78209
35114,172,CHIN'S CHINESE KITCHEN,4.6,200,"Chinese, Asian, Asian Fusion, Kids Friendly, Local Specialities",$,29.4893384,-98.5992307,5764 Evers Rd, San Antonio, TX,78238
35115,171,Tacos Betos,4.6,49,"Mexican, Burgers, Kids Friendly",$$,29.45047,-98.57686,3715 Culebra Road, San Antonio, TX,78228
35116,173,"Johnny Rockets (849 E. Commerce, Space 677)",,,"American, Fast Food, Kids Friendly, Diner, Kids Friendly, Comfort Food, Burgers, Chicken, Breakfast and Brunch",$,29.42385,-98.48476,849 E Commerce St, San Antonio, TX,78205
35118,169,Mr. Juicy,4.7,99,"American, Comfort Food, Kids Friendly",$,29.46623,-98.49965,3315 San Pedro Avenue, San Antonio, TX,78212
35119,168,Ida Claire - San Antonio,4.4,43,"American, Sandwich, Family Friendly",,29.4974717,-98.4787341,7300 Jones Maltsberger Rd, San Antonio, TX,78209
35120,166,Yuyus Piñas,4.8,11,"Desserts, Fruit, Kids Friendly",,29.58732,-98.45136,2235 Thousand Oaks Drive, San Antonio, TX,78232
35121,167,La Focaccia Italian Grill,4.2,44,"Italian, Pizza, Family Friendly",$,29.4157068,-98.4890307,800 S Alamo St, San Antonio, TX,78205
35122,164,Chow's Express,,,"Coffee and Tea, Kids Friendly, Snacks",,29.48385,-98.40658,4424 Rittiman Road, San Antonio, TX,78218
35124,163,BurgerFi San Antonio-Alamo Heights,4.6,48,"Burgers, American, Vegetarian Friendly",$,29.5076533,-98.4583523,1907 Nacogdoches Rd., San Antonio, TX,78209
35125,162,La Playa Seafood,4.3,32,"Mexican, Seafood, Kids Friendly, Family Meals",$,29.492729,-98.526245,3343 West Avenue, San Antonio, TX,78213
35126,161,Pho 32,4.6,90,"Vietnamese, Noodles, Healthy, Vegetarian, Vegetarian Friendly, Thai, Rice Dishes, Chinese, Pho",$,29.58634,-98.4503,2413 Thousand Oaks Dr, San Antonio, TX,78232
35127,160,Alida,,,"Sandwich, American, Allergy Friendly",$,29.418745,-98.505761,527 El Paso Street, San Antonio, TX,78207
35128,158,The Growler Exchange Pizza &amp; Beer,,,"Pizza, Italian, Comfort Food, Allergy Friendly",$$,29.4646496,-98.4640624,4130 Broadway St # 2, San Antonio, TX,78209
35129,159,Clementine,,,"Italian, Pasta, Comfort Food, Allergy Friendly",$,29.5326977,-98.5216488,2195 NW Military Hwy, San Antonio, TX,78213
35130,157,Acha Bacha Indian Cuisine,,,"Indian, Vegetarian, Asian, Allergy Friendly",,29.397702,-98.463814,535 Kayton Avenue, San Antonio, TX,78210
35131,156,Tacos Los Nortenos,,,"Mexican, Tacos, Allergy Friendly",,29.49418,-98.53543,2331 Vance Jackson Road, San Antonio, TX,78213
35132,154,Buffalo Kitchen q,,,"Burgers, American, Sandwiches, Allergy Friendly",$,29.55846,-98.39592,13032 Nacogdoches Road 200, San Antonio, TX,78217
35133,155,Center Court Pizza and Brew,,,"Pizza, American, Allergy Friendly",$,29.6351409,-98.5159138,20711 Wilderness Oak #113, San Antonio, TX,78260
35134,153,Burrikos ,4.5,14,"Mexican, Tacos, Burritos, Allergy Friendly",,29.42792,-98.4943,316 North Flores Street, San Antonio, TX,78205
35136,150,Ruth's Chris Steak House (600 E Market St),,,"Steak, American, Fast Food, Allergy Friendly",$$,29.4219236,-98.4848293,600 E Market St, San Antonio, TX,78205
35137,148,SUPER DOG (427 Lombrano Street),3.5,21,"American, Sandwich, Hot Dog, Allergy Friendly",$,29.44191,-98.51055,427 Lombrano Street, San Antonio, TX,78207
35138,147,SA Cloud Indian Kitchen,3.6,59,"Indian, Vegetarian, Asian, Allergy Friendly",,29.44191,-98.51055,427 Lombrano Street, San Antonio, TX,78207
35139,145,il Forno (San Antonio),4.5,41,"Pizza, American, Italian, Allergy Friendly",$,29.4084468,-98.5020033,122 Nogalitos St, San Antonio, TX,78204
35141,142,Indian Crepe Co. (9903 Fredericksburg Rd),,,"Indian, Vegetarian, Snacks, Street Food, Vegan Friendly",,29.53438,-98.57737,9903 Fredericksburg Rd, San Antonio, TX,78240
35142,141,Lentil (9903 Fredericksburg Rd),,,"Indian, Healthy, Vegan Friendly, Fast Food, Gluten Free",,29.53438,-98.57737,9903 Fredericksburg Rd, San Antonio, TX,78240
35143,140,India Taj Palace,4.8,76,"Indian, Indian Curry, Family Friendly",$$,29.6276438,-98.4937408,20323 Huebner Road, San Antonio, TX,78258
35144,138,Tacos El Regio - St. Mary's,4.6,200,"Mexican, Latin American, New Mexican, Group Friendly",$,29.4509066,-98.4862643,2726 North Saint Mary's Street, San Antonio, TX,78212
35145,137,Texas Crab Boil,4.1,54,"Seafood, Desserts, Kids Friendly",$,29.5040954,-98.6171405,6613 Evers Rd, San Antonio, TX,78240
35146,135,Chick-fil-A  (10503 NW Military Highway),4.8,200,"American, Fried Chicken, Family Meals, Southern, Sandwich, Fast Food, Group Friendly",$,29.5551092,-98.5346207,10503 NW Military Hwy, San Antonio, TX,78230
35147,133,Viva Vegeria,4.9,108,"Salads, Mexican, Vegetarian, Vegetarian Friendly, Vegan",$,29.3991856,-98.5124841,1422 Nogalitos, San Antonio, TX,78204
35149,131,Shifu Noodle,4.6,148,"Asian, Asian Fusion, Korean",$,29.38036,-98.4593,3850 S New Braunfels Ave, San Antonio, TX,78223
35150,127,Amigos Snacks And More #3,,,"Desserts, Kids Friendly, Snacks",,29.42401,-98.49302,126 East Main Plaza, San Antonio, TX,78205
35151,126,Papa Murphy's  (938 Wurzbach Pkwy),4.9,17,"Pizza, American, Salads, Healthy",$,29.5574027,-98.5186682,938 Wurzbach Pkwy, San Antonio, TX,78231
35153,124,Grand Buffet,4.1,19,"Chicken, Seafood, Salads, Healthy, Allergy Friendly",$,29.3580669,-98.5010573,615 SW Military Dr, San Antonio, TX,78221
35154,121,Golden Chick (26210 Canyon Golf Road),4.8,21,"American, Salads, Comfort Food, Family Meals, Healthy, Family Friendly",$,29.688865,-98.476766,26210 Canyon Golf Rd, San Antonio, TX,78260
35156,119,Hard Rock Cafe (San Antonio),,,"American, Traditional American, Comfort Food, Burgers, Steak, Chicken, Salads, Pasta, Kids Friendly, Desserts, Drinks, Cafe, Sandwich, Sandwiches",$,29.4251,-98.4894,111 W Crockett St, San Antonio, TX,78205
35157,118,Kilwins San Antonio,,,"Desserts, Kids Friendly, chocolatier, Ice Cream + Frozen Yogurt",$$,29.424076,-98.487326,109 Alamo Plaza, San Antonio, TX,78205
35158,117,El Chango Loco,4.9,18,"Ice Cream &amp; Frozen Yogurt, Comfort Food, Desserts, Allergy Friendly",$,29.351485,-98.503676,2802 Pleasanton Rd, San Antonio, TX,78221
35159,114,La Sorrentina,4.7,60,"Sandwich, Pasta, Pizza, Salads, Chicken, Steak, Seafood, Kids Friendly, Desserts",$$,29.448803,-98.566369,3330 Culebra Rd, San Antonio, TX,78228
35160,113,Cinnaholic (San Antonio),4.7,60,"Desserts, Bakery, Breakfast and Brunch, Coffee and Tea, Comfort Food, Vegan, Vegan Friendly, Vegetarian, Vegetarian Friendly, Healthy",$,29.41527,-98.48931,812 S. Alamo St., San Antonio, TX,78205
35161,111,Po Po Trattoria Pizzeria,4.1,18,"Italian, Pizza, Pasta, Family Friendly",$$,29.5851944,-98.533076,15614 Huebner Rd, San Antonio, TX,78248
35162,110,Wow Bao (2177 NW Military Hwy.),3.9,13,"Asian, Asian Fusion, Rice-bowls, Vegetarian Friendly, Chinese",$,29.5326,-98.52164,2177 Northwest Military Highway, San Antonio, TX,78213
35163,109,The Exclusive Cake Shop ,4.4,36,"Bakery, Cupcakes, Desserts, Allergy Friendly",,29.50128,-98.624261,7015 Bandera Rd #13, San Antonio, TX,78240
35164,107,Delice chocolatier &amp; patisserie,4.5,15,"Desserts, chocolatier, Pastry, Cupcakes, Gluten Free Friendly",$,29.6078432,-98.5050562,946 N Loop 1604 W, San Antonio, TX,78232
35165,106,Kumori Sushi &amp; Teppanyaki - Stone Oak,4.8,89,"Sushi, Japanese, Desserts, Family Friendly",$$,29.6143297,-98.4849992,700 E Sonterra Blvd, San Antonio, TX,78232
35168,102,Li's Restaurant  &amp; Sushi Bar,4.5,107,"Chinese, Seafood, Noodles, Chicken, Vegetarian Friendly, Family Friendly, Allergy Friendly, Sushi, Japanese",$$,29.62605,-98.49326,20330 Huebner Rd, San Antonio, TX,78258
35169,101,Yellowfish Sushi (Wurzbach),4.8,65,"Sushi, Family Friendly",$,29.5267359,-98.5662186,9102 Wurzbach Rd, San Antonio, TX,78240
